16:18:22.055846 IP (tos 0x0, ttl 54, id 0, offset 0, flags [DF], proto TCP (6), length 60)
    zoolab.cs.nctu.edu.tw.10001 > 172.28.96.148.34130: Flags [S.], cksum 0xeafb (correct), seq 1663789003, ack 4119350629, win 65160, options [mss 1460,sackOK,TS val 4249369748 ecr 3367776913,nop,wscale 7], length 0
16:18:22.061539 IP (tos 0x8c, ttl 131, id 10211, offset 0, flags [DF], proto TCP (6), length 52)
    zoolab.cs.nctu.edu.tw.10001 > 172.28.96.148.34130: Flags [P.], cksum 0x14c4 (correct), ack 1, win 510, options [nop,nop,TS val 4249369752 ecr 3367776916], length 0
16:18:22.061539 IP (tos 0x80, ttl 119, id 10212, offset 0, flags [DF], proto TCP (6), length 52)
    zoolab.cs.nctu.edu.tw.10001 > 172.28.96.148.34130: Flags [P.], cksum 0x114f (correct), ack 1, win 510, options [nop,nop,TS val 4249369752 ecr 3367776916], length 0
16:18:22.061539 IP (tos 0x8c, ttl 132, id 10213, offset 0, flags [DF], proto TCP (6), length 52)
    zoolab.cs.nctu.edu.tw.10001 > 172.28.96.148.34130: Flags [P.], cksum 0x0ea0 (correct), ack 1, win 510, options [nop,nop,TS val 4249369752 ecr 3367776916], length 0
16:18:22.061762 IP (tos 0x88, ttl 126, id 10214, offset 0, flags [DF], proto TCP (6), length 523)
    zoolab.cs.nctu.edu.tw.10001 > 172.28.96.148.34130: Flags [P.], cksum 0x0d71 (correct), seq 2917:3388, ack 1, win 510, options [nop,nop,TS val 4249369752 ecr 3367776916], length 471
16:18:22.061762 IP (tos 0x84, ttl 124, id 10215, offset 0, flags [DF], proto TCP (6), length 228)
    zoolab.cs.nctu.edu.tw.10001 > 172.28.96.148.34130: Flags [P.], cksum 0xd6ae (correct), seq 3388:3564, ack 1, win 510, options [nop,nop,TS val 4249369753 ecr 3367776916], length 176
16:18:22.061762 IP (tos 0x88, ttl 126, id 10216, offset 0, flags [DF], proto TCP (6), length 904)
    zoolab.cs.nctu.edu.tw.10001 > 172.28.96.148.34130: Flags [P.], cksum 0x870c (correct), seq 3564:4416, ack 1, win 510, options [nop,nop,TS val 4249369753 ecr 3367776916], length 852
16:18:22.061762 IP (tos 0x84, ttl 124, id 10217, offset 0, flags [DF], proto TCP (6), length 388)
    zoolab.cs.nctu.edu.tw.10001 > 172.28.96.148.34130: Flags [P.], cksum 0x630e (correct), seq 4416:4752, ack 1, win 510, options [nop,nop,TS val 4249369753 ecr 3367776916], length 336
16:18:22.061762 IP (tos 0x80, ttl 121, id 10218, offset 0, flags [DF], proto TCP (6), length 341)
    zoolab.cs.nctu.edu.tw.10001 > 172.28.96.148.34130: Flags [P.], cksum 0x1d41 (correct), seq 4752:5041, ack 1, win 510, options [nop,nop,TS val 4249369753 ecr 3367776916], length 289
16:18:22.061762 IP (tos 0x84, ttl 124, id 10219, offset 0, flags [DF], proto TCP (6), length 519)
    zoolab.cs.nctu.edu.tw.10001 > 172.28.96.148.34130: Flags [P.], cksum 0x82ad (correct), seq 5041:5508, ack 1, win 510, options [nop,nop,TS val 4249369753 ecr 3367776916], length 467
16:18:22.067304 IP (tos 0x80, ttl 121, id 10220, offset 0, flags [DF], proto TCP (6), length 1321)
    zoolab.cs.nctu.edu.tw.10001 > 172.28.96.148.34130: Flags [P.], cksum 0xe2f1 (correct), seq 1:1270, ack 1, win 510, options [nop,nop,TS val 4249369756 ecr 3367776922], length 1269
16:18:22.067304 IP (tos 0x80, ttl 119, id 10212, offset 0, flags [DF], proto TCP (6), length 739)
    zoolab.cs.nctu.edu.tw.10001 > 172.28.96.148.34130: Flags [P.], cksum 0xa6a3 (correct), seq 1270:1957, ack 1, win 510, options [nop,nop,TS val 4249369752 ecr 3367776916], length 687
16:18:22.067304 IP (tos 0x8c, ttl 132, id 10213, offset 0, flags [DF], proto TCP (6), length 1012)
    zoolab.cs.nctu.edu.tw.10001 > 172.28.96.148.34130: Flags [P.], cksum 0x15d8 (correct), seq 1957:2917, ack 1, win 510, options [nop,nop,TS val 4249369752 ecr 3367776916], length 960
16:18:22.067304 IP (tos 0x80, ttl 121, id 10221, offset 0, flags [DF], proto TCP (6), length 1500)
    zoolab.cs.nctu.edu.tw.10001 > 172.28.96.148.34130: Flags [.], cksum 0xd1cf (correct), seq 5508:6956, ack 1, win 510, options [nop,nop,TS val 4249369756 ecr 3367776922], length 1448
16:18:22.067305 IP (tos 0x80, ttl 121, id 10222, offset 0, flags [DF], proto TCP (6), length 739)
    zoolab.cs.nctu.edu.tw.10001 > 172.28.96.148.34130: Flags [P.], cksum 0xa699 (correct), seq 1270:1957, ack 1, win 510, options [nop,nop,TS val 4249369756 ecr 3367776922], length 687
16:18:22.067305 IP (tos 0x80, ttl 121, id 10223, offset 0, flags [DF], proto TCP (6), length 1012)
    zoolab.cs.nctu.edu.tw.10001 > 172.28.96.148.34130: Flags [P.], cksum 0x15ce (correct), seq 1957:2917, ack 1, win 510, options [nop,nop,TS val 4249369756 ecr 3367776922], length 960
16:18:22.067305 IP (tos 0x80, ttl 121, id 10224, offset 0, flags [DF], proto TCP (6), length 4396)
    zoolab.cs.nctu.edu.tw.10001 > 172.28.96.148.34130: Flags [P.], cksum 0x8016 (incorrect -> 0xda79), seq 6956:11300, ack 1, win 510, options [nop,nop,TS val 4249369756 ecr 3367776922], length 4344
16:18:22.073367 IP (tos 0x84, ttl 123, id 10227, offset 0, flags [DF], proto TCP (6), length 7292)
    zoolab.cs.nctu.edu.tw.10001 > 172.28.96.148.34130: Flags [P.], cksum 0x8b66 (incorrect -> 0xd7f2), seq 11300:18540, ack 1, win 510, options [nop,nop,TS val 4249369762 ecr 3367776928], length 7240
16:18:22.073367 IP (tos 0x80, ttl 120, id 10232, offset 0, flags [DF], proto TCP (6), length 2948)
    zoolab.cs.nctu.edu.tw.10001 > 172.28.96.148.34130: Flags [P.], cksum 0x7a6e (incorrect -> 0x6dbf), seq 18540:21436, ack 1, win 510, options [nop,nop,TS val 4249369762 ecr 3367776928], length 2896
16:18:22.080190 IP (tos 0x80, ttl 121, id 10234, offset 0, flags [DF], proto TCP (6), length 2948)
    zoolab.cs.nctu.edu.tw.10001 > 172.28.96.148.34130: Flags [P.], cksum 0x7a6e (incorrect -> 0xf3ff), seq 21436:24332, ack 1, win 510, options [nop,nop,TS val 4249369768 ecr 3367776934], length 2896
16:18:22.080190 IP (tos 0x80, ttl 121, id 10236, offset 0, flags [DF], proto TCP (6), length 2948)
    zoolab.cs.nctu.edu.tw.10001 > 172.28.96.148.34130: Flags [P.], cksum 0x7a6e (incorrect -> 0x9058), seq 24332:27228, ack 1, win 510, options [nop,nop,TS val 4249369768 ecr 3367776934], length 2896
16:18:22.080393 IP (tos 0x80, ttl 121, id 10238, offset 0, flags [DF], proto TCP (6), length 2948)
    zoolab.cs.nctu.edu.tw.10001 > 172.28.96.148.34130: Flags [P.], cksum 0x7a6e (incorrect -> 0x911d), seq 27228:30124, ack 1, win 510, options [nop,nop,TS val 4249369768 ecr 3367776934], length 2896
16:18:22.080394 IP (tos 0x80, ttl 121, id 10240, offset 0, flags [DF], proto TCP (6), length 2948)
    zoolab.cs.nctu.edu.tw.10001 > 172.28.96.148.34130: Flags [P.], cksum 0x7a6e (incorrect -> 0x0ef1), seq 30124:33020, ack 1, win 510, options [nop,nop,TS val 4249369768 ecr 3367776934], length 2896
16:18:22.086618 IP (tos 0x80, ttl 121, id 10242, offset 0, flags [DF], proto TCP (6), length 2948)
    zoolab.cs.nctu.edu.tw.10001 > 172.28.96.148.34130: Flags [P.], cksum 0x7a6e (incorrect -> 0xd67c), seq 33020:35916, ack 1, win 510, options [nop,nop,TS val 4249369775 ecr 3367776941], length 2896
16:18:22.086618 IP (tos 0x80, ttl 121, id 10244, offset 0, flags [DF], proto TCP (6), length 2948)
    zoolab.cs.nctu.edu.tw.10001 > 172.28.96.148.34130: Flags [P.], cksum 0x7a6e (incorrect -> 0xb068), seq 35916:38812, ack 1, win 510, options [nop,nop,TS val 4249369775 ecr 3367776941], length 2896
16:18:22.086619 IP (tos 0x80, ttl 121, id 10246, offset 0, flags [DF], proto TCP (6), length 2948)
    zoolab.cs.nctu.edu.tw.10001 > 172.28.96.148.34130: Flags [P.], cksum 0x7a6e (incorrect -> 0x5a0c), seq 38812:41708, ack 1, win 510, options [nop,nop,TS val 4249369775 ecr 3367776941], length 2896
16:18:22.086619 IP (tos 0x80, ttl 121, id 10248, offset 0, flags [DF], proto TCP (6), length 1500)
    zoolab.cs.nctu.edu.tw.10001 > 172.28.96.148.34130: Flags [.], cksum 0xddaa (correct), seq 41708:43156, ack 1, win 510, options [nop,nop,TS val 4249369775 ecr 3367776941], length 1448
16:18:22.086837 IP (tos 0x80, ttl 121, id 10249, offset 0, flags [DF], proto TCP (6), length 1500)
    zoolab.cs.nctu.edu.tw.10001 > 172.28.96.148.34130: Flags [P.], cksum 0x58a9 (correct), seq 43156:44604, ack 1, win 510, options [nop,nop,TS val 4249369775 ecr 3367776941], length 1448
16:18:22.087578 IP (tos 0x88, ttl 128, id 10250, offset 0, flags [DF], proto TCP (6), length 2948)
    zoolab.cs.nctu.edu.tw.10001 > 172.28.96.148.34130: Flags [P.], cksum 0x7a6e (incorrect -> 0x7bd8), seq 44604:47500, ack 1, win 510, options [nop,nop,TS val 4249369781 ecr 3367776947], length 2896
16:18:22.087578 IP (tos 0x88, ttl 128, id 10252, offset 0, flags [DF], proto TCP (6), length 1500)
    zoolab.cs.nctu.edu.tw.10001 > 172.28.96.148.34130: Flags [.], cksum 0xbed1 (correct), seq 47500:48948, ack 1, win 510, options [nop,nop,TS val 4249369781 ecr 3367776947], length 1448
16:18:22.087794 IP (tos 0x88, ttl 128, id 10253, offset 0, flags [DF], proto TCP (6), length 1500)
    zoolab.cs.nctu.edu.tw.10001 > 172.28.96.148.34130: Flags [P.], cksum 0x3215 (correct), seq 48948:50396, ack 1, win 510, options [nop,nop,TS val 4249369781 ecr 3367776947], length 1448
16:18:22.087794 IP (tos 0x88, ttl 128, id 10254, offset 0, flags [DF], proto TCP (6), length 2948)
    zoolab.cs.nctu.edu.tw.10001 > 172.28.96.148.34130: Flags [P.], cksum 0x7a6e (incorrect -> 0x4807), seq 50396:53292, ack 1, win 510, options [nop,nop,TS val 4249369781 ecr 3367776947], length 2896
16:18:22.088006 IP (tos 0x88, ttl 127, id 10256, offset 0, flags [DF], proto TCP (6), length 2948)
    zoolab.cs.nctu.edu.tw.10001 > 172.28.96.148.34130: Flags [P.], cksum 0x7a6e (incorrect -> 0xd2bb), seq 53292:56188, ack 1, win 510, options [nop,nop,TS val 4249369781 ecr 3367776947], length 2896
16:18:22.089406 IP (tos 0x88, ttl 128, id 10258, offset 0, flags [DF], proto TCP (6), length 2948)
    zoolab.cs.nctu.edu.tw.10001 > 172.28.96.148.34130: Flags [P.], cksum 0x7a6e (incorrect -> 0x4982), seq 56188:59084, ack 1, win 510, options [nop,nop,TS val 4249369782 ecr 3367776948], length 2896
16:18:22.089406 IP (tos 0x88, ttl 128, id 10260, offset 0, flags [DF], proto TCP (6), length 1500)
    zoolab.cs.nctu.edu.tw.10001 > 172.28.96.148.34130: Flags [.], cksum 0x31d6 (correct), seq 59084:60532, ack 1, win 510, options [nop,nop,TS val 4249369782 ecr 3367776948], length 1448
16:18:22.089407 IP (tos 0x88, ttl 129, id 10261, offset 0, flags [DF], proto TCP (6), length 2948)
    zoolab.cs.nctu.edu.tw.10001 > 172.28.96.148.34130: Flags [P.], cksum 0x7a6e (incorrect -> 0xb0aa), seq 60532:63428, ack 1, win 510, options [nop,nop,TS val 4249369782 ecr 3367776948], length 2896
16:18:22.089407 IP (tos 0x88, ttl 129, id 10263, offset 0, flags [DF], proto TCP (6), length 1500)
    zoolab.cs.nctu.edu.tw.10001 > 172.28.96.148.34130: Flags [.], cksum 0x1a57 (correct), seq 63428:64876, ack 1, win 510, options [nop,nop,TS val 4249369782 ecr 3367776948], length 1448
16:18:22.089407 IP (tos 0x84, ttl 124, id 10264, offset 0, flags [DF], proto TCP (6), length 2948)
    zoolab.cs.nctu.edu.tw.10001 > 172.28.96.148.34130: Flags [P.], cksum 0x7a6e (incorrect -> 0x3d28), seq 64876:67772, ack 1, win 510, options [nop,nop,TS val 4249369782 ecr 3367776948], length 2896
16:18:22.090499 IP (tos 0x84, ttl 122, id 10266, offset 0, flags [DF], proto TCP (6), length 2948)
    zoolab.cs.nctu.edu.tw.10001 > 172.28.96.148.34130: Flags [P.], cksum 0x7a6e (incorrect -> 0x5d32), seq 67772:70668, ack 1, win 510, options [nop,nop,TS val 4249369784 ecr 3367776950], length 2896
16:18:22.090765 IP (tos 0x84, ttl 122, id 10268, offset 0, flags [DF], proto TCP (6), length 2948)
    zoolab.cs.nctu.edu.tw.10001 > 172.28.96.148.34130: Flags [P.], cksum 0x7a6e (incorrect -> 0x8a54), seq 70668:73564, ack 1, win 510, options [nop,nop,TS val 4249369784 ecr 3367776950], length 2896
16:18:22.090765 IP (tos 0x84, ttl 122, id 10270, offset 0, flags [DF], proto TCP (6), length 2948)
    zoolab.cs.nctu.edu.tw.10001 > 172.28.96.148.34130: Flags [P.], cksum 0x7a6e (incorrect -> 0x4bea), seq 73564:76460, ack 1, win 510, options [nop,nop,TS val 4249369784 ecr 3367776950], length 2896
16:18:22.090765 IP (tos 0x84, ttl 122, id 10272, offset 0, flags [DF], proto TCP (6), length 2948)
    zoolab.cs.nctu.edu.tw.10001 > 172.28.96.148.34130: Flags [P.], cksum 0x7a6e (incorrect -> 0x7d72), seq 76460:79356, ack 1, win 510, options [nop,nop,TS val 4249369784 ecr 3367776950], length 2896
16:18:22.091502 IP (tos 0x80, ttl 119, id 10274, offset 0, flags [DF], proto TCP (6), length 2948)
    zoolab.cs.nctu.edu.tw.10001 > 172.28.96.148.34130: Flags [P.], cksum 0x7a6e (incorrect -> 0xd89f), seq 79356:82252, ack 1, win 510, options [nop,nop,TS val 4249369785 ecr 3367776951], length 2896
16:18:22.092156 IP (tos 0x8c, ttl 130, id 10276, offset 0, flags [DF], proto TCP (6), length 4396)
    zoolab.cs.nctu.edu.tw.10001 > 172.28.96.148.34130: Flags [P.], cksum 0x8016 (incorrect -> 0xf468), seq 82252:86596, ack 1, win 510, options [nop,nop,TS val 4249369785 ecr 3367776951], length 4344
16:18:22.092157 IP (tos 0x8c, ttl 130, id 10279, offset 0, flags [DF], proto TCP (6), length 4396)
    zoolab.cs.nctu.edu.tw.10001 > 172.28.96.148.34130: Flags [P.], cksum 0x8016 (incorrect -> 0x27c3), seq 86596:90940, ack 1, win 510, options [nop,nop,TS val 4249369785 ecr 3367776951], length 4344
16:18:22.092722 IP (tos 0x84, ttl 124, id 10282, offset 0, flags [DF], proto TCP (6), length 2948)
    zoolab.cs.nctu.edu.tw.10001 > 172.28.96.148.34130: Flags [P.], cksum 0x7a6e (incorrect -> 0xe2a4), seq 90940:93836, ack 1, win 510, options [nop,nop,TS val 4249369786 ecr 3367776952], length 2896
16:18:22.093201 IP (tos 0x84, ttl 124, id 10284, offset 0, flags [DF], proto TCP (6), length 4396)
    zoolab.cs.nctu.edu.tw.10001 > 172.28.96.148.34130: Flags [P.], cksum 0x8016 (incorrect -> 0x52d3), seq 93836:98180, ack 1, win 510, options [nop,nop,TS val 4249369786 ecr 3367776953], length 4344
16:18:22.093368 IP (tos 0x84, ttl 124, id 10287, offset 0, flags [DF], proto TCP (6), length 4396)
    zoolab.cs.nctu.edu.tw.10001 > 172.28.96.148.34130: Flags [P.], cksum 0x8016 (incorrect -> 0x8e9a), seq 98180:102524, ack 1, win 510, options [nop,nop,TS val 4249369786 ecr 3367776953], length 4344
16:18:22.093907 IP (tos 0x8c, ttl 133, id 10290, offset 0, flags [DF], proto TCP (6), length 2948)
    zoolab.cs.nctu.edu.tw.10001 > 172.28.96.148.34130: Flags [P.], cksum 0x7a6e (incorrect -> 0xcaa7), seq 102524:105420, ack 1, win 510, options [nop,nop,TS val 4249369787 ecr 3367776953], length 2896
16:18:22.094110 IP (tos 0x8c, ttl 130, id 10292, offset 0, flags [DF], proto TCP (6), length 1500)
    zoolab.cs.nctu.edu.tw.10001 > 172.28.96.148.34130: Flags [.], cksum 0x3c7a (correct), seq 105420:106868, ack 1, win 510, options [nop,nop,TS val 4249369787 ecr 3367776954], length 1448
16:18:22.094345 IP (tos 0x8c, ttl 130, id 10293, offset 0, flags [DF], proto TCP (6), length 2948)
    zoolab.cs.nctu.edu.tw.10001 > 172.28.96.148.34130: Flags [P.], cksum 0x7a6e (incorrect -> 0xd697), seq 106868:109764, ack 1, win 510, options [nop,nop,TS val 4249369787 ecr 3367776954], length 2896
16:18:22.094346 IP (tos 0x8c, ttl 130, id 10295, offset 0, flags [DF], proto TCP (6), length 4396)
    zoolab.cs.nctu.edu.tw.10001 > 172.28.96.148.34130: Flags [P.], cksum 0x8016 (incorrect -> 0x4c10), seq 109764:114108, ack 1, win 510, options [nop,nop,TS val 4249369787 ecr 3367776954], length 4344
16:18:22.095382 IP (tos 0x88, ttl 128, id 10298, offset 0, flags [DF], proto TCP (6), length 2948)
    zoolab.cs.nctu.edu.tw.10001 > 172.28.96.148.34130: Flags [P.], cksum 0x7a6e (incorrect -> 0xa54f), seq 114108:117004, ack 1, win 510, options [nop,nop,TS val 4249369788 ecr 3367776954], length 2896
16:18:22.095382 IP (tos 0x88, ttl 128, id 10300, offset 0, flags [DF], proto TCP (6), length 1500)
    zoolab.cs.nctu.edu.tw.10001 > 172.28.96.148.34130: Flags [.], cksum 0x82c7 (correct), seq 117004:118452, ack 1, win 510, options [nop,nop,TS val 4249369788 ecr 3367776954], length 1448
16:18:22.095668 IP (tos 0x88, ttl 127, id 10301, offset 0, flags [DF], proto TCP (6), length 2300)
    zoolab.cs.nctu.edu.tw.10001 > 172.28.96.148.34130: Flags [P.], cksum 0x77e6 (incorrect -> 0x3841), seq 118452:120700, ack 1, win 510, options [nop,nop,TS val 4249369788 ecr 3367776955], length 2248
16:18:22.095668 IP (tos 0x8c, ttl 131, id 10303, offset 0, flags [DF], proto TCP (6), length 579)
    zoolab.cs.nctu.edu.tw.10001 > 172.28.96.148.34130: Flags [P.], cksum 0x96c9 (correct), seq 120700:121227, ack 1, win 510, options [nop,nop,TS val 4249369788 ecr 3367776955], length 527
16:18:22.095669 IP (tos 0x84, ttl 125, id 10304, offset 0, flags [DF], proto TCP (6), length 647)
    zoolab.cs.nctu.edu.tw.10001 > 172.28.96.148.34130: Flags [P.], cksum 0x2c9c (correct), seq 121227:121822, ack 1, win 510, options [nop,nop,TS val 4249369789 ecr 3367776955], length 595
16:18:22.096063 IP (tos 0x84, ttl 123, id 10305, offset 0, flags [DF], proto TCP (6), length 742)
    zoolab.cs.nctu.edu.tw.10001 > 172.28.96.148.34130: Flags [P.], cksum 0x1700 (correct), seq 121822:122512, ack 1, win 510, options [nop,nop,TS val 4249369789 ecr 3367776955], length 690
16:18:22.096931 IP (tos 0x8c, ttl 132, id 10306, offset 0, flags [DF], proto TCP (6), length 2948)
    zoolab.cs.nctu.edu.tw.10001 > 172.28.96.148.34130: Flags [P.], cksum 0x7a6e (incorrect -> 0x8999), seq 122512:125408, ack 1, win 510, options [nop,nop,TS val 4249369790 ecr 3367776956], length 2896
16:18:22.096931 IP (tos 0x8c, ttl 132, id 10308, offset 0, flags [DF], proto TCP (6), length 783)
    zoolab.cs.nctu.edu.tw.10001 > 172.28.96.148.34130: Flags [P.], cksum 0x02cb (correct), seq 125408:126139, ack 1, win 510, options [nop,nop,TS val 4249369790 ecr 3367776956], length 731
16:18:22.096931 IP (tos 0x84, ttl 123, id 10309, offset 0, flags [DF], proto TCP (6), length 372)
    zoolab.cs.nctu.edu.tw.10001 > 172.28.96.148.34130: Flags [P.], cksum 0x033c (correct), seq 126139:126459, ack 1, win 510, options [nop,nop,TS val 4249369790 ecr 3367776956], length 320
16:18:22.097133 IP (tos 0x84, ttl 122, id 10310, offset 0, flags [DF], proto TCP (6), length 141)
    zoolab.cs.nctu.edu.tw.10001 > 172.28.96.148.34130: Flags [P.], cksum 0xfad6 (correct), seq 126459:126548, ack 1, win 510, options [nop,nop,TS val 4249369790 ecr 3367776956], length 89
16:18:22.097714 IP (tos 0x84, ttl 123, id 10311, offset 0, flags [DF], proto TCP (6), length 843)
    zoolab.cs.nctu.edu.tw.10001 > 172.28.96.148.34130: Flags [P.], cksum 0xfb50 (correct), seq 126548:127339, ack 1, win 510, options [nop,nop,TS val 4249369790 ecr 3367776956], length 791
16:18:22.097714 IP (tos 0x8c, ttl 131, id 10312, offset 0, flags [DF], proto TCP (6), length 274)
    zoolab.cs.nctu.edu.tw.10001 > 172.28.96.148.34130: Flags [P.], cksum 0x9b72 (correct), seq 127339:127561, ack 1, win 510, options [nop,nop,TS val 4249369791 ecr 3367776956], length 222
16:18:22.097906 IP (tos 0x84, ttl 125, id 10313, offset 0, flags [DF], proto TCP (6), length 775)
    zoolab.cs.nctu.edu.tw.10001 > 172.28.96.148.34130: Flags [P.], cksum 0xf4a6 (correct), seq 127561:128284, ack 1, win 510, options [nop,nop,TS val 4249369791 ecr 3367776956], length 723
16:18:22.098130 IP (tos 0x80, ttl 121, id 10314, offset 0, flags [DF], proto TCP (6), length 498)
    zoolab.cs.nctu.edu.tw.10001 > 172.28.96.148.34130: Flags [P.], cksum 0xd663 (correct), seq 128284:128730, ack 1, win 510, options [nop,nop,TS val 4249369791 ecr 3367776957], length 446
16:18:22.098130 IP (tos 0x84, ttl 124, id 10315, offset 0, flags [DF], proto TCP (6), length 600)
    zoolab.cs.nctu.edu.tw.10001 > 172.28.96.148.34130: Flags [P.], cksum 0xbb93 (correct), seq 128730:129278, ack 1, win 510, options [nop,nop,TS val 4249369791 ecr 3367776958], length 548
16:18:22.098130 IP (tos 0x84, ttl 125, id 10316, offset 0, flags [DF], proto TCP (6), length 856)
    zoolab.cs.nctu.edu.tw.10001 > 172.28.96.148.34130: Flags [P.], cksum 0xe014 (correct), seq 129278:130082, ack 1, win 510, options [nop,nop,TS val 4249369791 ecr 3367776958], length 804
16:18:22.098369 IP (tos 0x8c, ttl 131, id 10317, offset 0, flags [DF], proto TCP (6), length 1103)
    zoolab.cs.nctu.edu.tw.10001 > 172.28.96.148.34130: Flags [P.], cksum 0xc54f (correct), seq 130082:131133, ack 1, win 510, options [nop,nop,TS val 4249369792 ecr 3367776958], length 1051
16:18:22.098369 IP (tos 0x80, ttl 121, id 10318, offset 0, flags [DF], proto TCP (6), length 824)
    zoolab.cs.nctu.edu.tw.10001 > 172.28.96.148.34130: Flags [P.], cksum 0x2527 (correct), seq 131133:131905, ack 1, win 510, options [nop,nop,TS val 4249369792 ecr 3367776958], length 772
16:18:22.098988 IP (tos 0x80, ttl 118, id 10319, offset 0, flags [DF], proto TCP (6), length 1062)
    zoolab.cs.nctu.edu.tw.10001 > 172.28.96.148.34130: Flags [P.], cksum 0x9c4d (correct), seq 131905:132915, ack 1, win 510, options [nop,nop,TS val 4249369792 ecr 3367776958], length 1010
16:18:22.099199 IP (tos 0x8c, ttl 130, id 10320, offset 0, flags [DF], proto TCP (6), length 812)
    zoolab.cs.nctu.edu.tw.10001 > 172.28.96.148.34130: Flags [P.], cksum 0xcf17 (correct), seq 132915:133675, ack 1, win 510, options [nop,nop,TS val 4249369792 ecr 3367776958], length 760
16:18:22.099199 IP (tos 0x88, ttl 129, id 10321, offset 0, flags [DF], proto TCP (6), length 1072)
    zoolab.cs.nctu.edu.tw.10001 > 172.28.96.148.34130: Flags [P.], cksum 0xb7a8 (correct), seq 133675:134695, ack 1, win 510, options [nop,nop,TS val 4249369792 ecr 3367776959], length 1020
16:18:22.099792 IP (tos 0x8c, ttl 130, id 10322, offset 0, flags [DF], proto TCP (6), length 821)
    zoolab.cs.nctu.edu.tw.10001 > 172.28.96.148.34130: Flags [P.], cksum 0x8f3f (correct), seq 134695:135464, ack 1, win 510, options [nop,nop,TS val 4249369793 ecr 3367776959], length 769
16:18:22.099793 IP (tos 0x80, ttl 121, id 10323, offset 0, flags [DF], proto TCP (6), length 595)
    zoolab.cs.nctu.edu.tw.10001 > 172.28.96.148.34130: Flags [P.], cksum 0x1397 (correct), seq 135464:136007, ack 1, win 510, options [nop,nop,TS val 4249369793 ecr 3367776959], length 543
16:18:22.100001 IP (tos 0x88, ttl 129, id 10324, offset 0, flags [DF], proto TCP (6), length 1050)
    zoolab.cs.nctu.edu.tw.10001 > 172.28.96.148.34130: Flags [P.], cksum 0x6c37 (correct), seq 136007:137005, ack 1, win 510, options [nop,nop,TS val 4249369793 ecr 3367776959], length 998
16:18:22.100001 IP (tos 0x84, ttl 124, id 10325, offset 0, flags [DF], proto TCP (6), length 765)
    zoolab.cs.nctu.edu.tw.10001 > 172.28.96.148.34130: Flags [P.], cksum 0x605a (correct), seq 137005:137718, ack 1, win 510, options [nop,nop,TS val 4249369793 ecr 3367776959], length 713
16:18:22.100341 IP (tos 0x80, ttl 121, id 10326, offset 0, flags [DF], proto TCP (6), length 596)
    zoolab.cs.nctu.edu.tw.10001 > 172.28.96.148.34130: Flags [P.], cksum 0x6064 (correct), seq 137718:138262, ack 1, win 510, options [nop,nop,TS val 4249369793 ecr 3367776960], length 544
16:18:22.100545 IP (tos 0x88, ttl 129, id 10327, offset 0, flags [DF], proto TCP (6), length 683)
    zoolab.cs.nctu.edu.tw.10001 > 172.28.96.148.34130: Flags [P.], cksum 0xb797 (correct), seq 138262:138893, ack 1, win 510, options [nop,nop,TS val 4249369794 ecr 3367776960], length 631
16:18:22.100756 IP (tos 0x88, ttl 126, id 10328, offset 0, flags [DF], proto TCP (6), length 440)
    zoolab.cs.nctu.edu.tw.10001 > 172.28.96.148.34130: Flags [P.], cksum 0x1035 (correct), seq 138893:139281, ack 1, win 510, options [nop,nop,TS val 4249369794 ecr 3367776960], length 388
16:18:22.100756 IP (tos 0x84, ttl 123, id 10329, offset 0, flags [DF], proto TCP (6), length 395)
    zoolab.cs.nctu.edu.tw.10001 > 172.28.96.148.34130: Flags [P.], cksum 0x10dd (correct), seq 139281:139624, ack 1, win 510, options [nop,nop,TS val 4249369794 ecr 3367776960], length 343
16:18:22.101109 IP (tos 0x88, ttl 129, id 10330, offset 0, flags [DF], proto TCP (6), length 812)
    zoolab.cs.nctu.edu.tw.10001 > 172.28.96.148.34130: Flags [P.], cksum 0x3ca8 (correct), seq 139624:140384, ack 1, win 510, options [nop,nop,TS val 4249369794 ecr 3367776960], length 760
16:18:22.101217 IP (tos 0x88, ttl 127, id 10331, offset 0, flags [DF], proto TCP (6), length 1128)
    zoolab.cs.nctu.edu.tw.10001 > 172.28.96.148.34130: Flags [P.], cksum 0xc100 (correct), seq 140384:141460, ack 1, win 510, options [nop,nop,TS val 4249369794 ecr 3367776960], length 1076
16:18:22.102521 IP (tos 0x84, ttl 123, id 10332, offset 0, flags [DF], proto TCP (6), length 852)
    zoolab.cs.nctu.edu.tw.10001 > 172.28.96.148.34130: Flags [P.], cksum 0x230d (correct), seq 141460:142260, ack 1, win 510, options [nop,nop,TS val 4249369794 ecr 3367776960], length 800
16:18:22.102522 IP (tos 0x84, ttl 122, id 10333, offset 0, flags [DF], proto TCP (6), length 608)
    zoolab.cs.nctu.edu.tw.10001 > 172.28.96.148.34130: Flags [P.], cksum 0x9c04 (correct), seq 142260:142816, ack 1, win 510, options [nop,nop,TS val 4249369795 ecr 3367776961], length 556
16:18:22.102522 IP (tos 0x80, ttl 120, id 10334, offset 0, flags [DF], proto TCP (6), length 915)
    zoolab.cs.nctu.edu.tw.10001 > 172.28.96.148.34130: Flags [P.], cksum 0xed86 (correct), seq 142816:143679, ack 1, win 510, options [nop,nop,TS val 4249369795 ecr 3367776961], length 863
16:18:22.102522 IP (tos 0x84, ttl 122, id 10335, offset 0, flags [DF], proto TCP (6), length 863)
    zoolab.cs.nctu.edu.tw.10001 > 172.28.96.148.34130: Flags [P.], cksum 0x8a0f (correct), seq 143679:144490, ack 1, win 510, options [nop,nop,TS val 4249369795 ecr 3367776961], length 811
16:18:22.102522 IP (tos 0x88, ttl 128, id 10336, offset 0, flags [DF], proto TCP (6), length 437)
    zoolab.cs.nctu.edu.tw.10001 > 172.28.96.148.34130: Flags [P.], cksum 0x1a05 (correct), seq 144490:144875, ack 1, win 510, options [nop,nop,TS val 4249369795 ecr 3367776961], length 385
16:18:22.102728 IP (tos 0x88, ttl 129, id 10337, offset 0, flags [DF], proto TCP (6), length 1096)
    zoolab.cs.nctu.edu.tw.10001 > 172.28.96.148.34130: Flags [P.], cksum 0x38cc (correct), seq 144875:145919, ack 1, win 510, options [nop,nop,TS val 4249369795 ecr 3367776962], length 1044
16:18:22.102728 IP (tos 0x80, ttl 118, id 10338, offset 0, flags [DF], proto TCP (6), length 307)
    zoolab.cs.nctu.edu.tw.10001 > 172.28.96.148.34130: Flags [P.], cksum 0x0e1a (correct), seq 145919:146174, ack 1, win 510, options [nop,nop,TS val 4249369796 ecr 3367776962], length 255
16:18:22.102728 IP (tos 0x88, ttl 126, id 10339, offset 0, flags [DF], proto TCP (6), length 747)
    zoolab.cs.nctu.edu.tw.10001 > 172.28.96.148.34130: Flags [P.], cksum 0xee7c (correct), seq 146174:146869, ack 1, win 510, options [nop,nop,TS val 4249369796 ecr 3367776962], length 695
16:18:22.103590 IP (tos 0x80, ttl 119, id 10340, offset 0, flags [DF], proto TCP (6), length 2569)
    zoolab.cs.nctu.edu.tw.10001 > 172.28.96.148.34130: Flags [P.], cksum 0x78f3 (incorrect -> 0xd200), seq 146869:149386, ack 1, win 510, options [nop,nop,TS val 4249369797 ecr 3367776963], length 2517
16:18:22.103590 IP (tos 0x8c, ttl 132, id 10342, offset 0, flags [DF], proto TCP (6), length 480)
    zoolab.cs.nctu.edu.tw.10001 > 172.28.96.148.34130: Flags [P.], cksum 0x45e8 (correct), seq 149386:149814, ack 1, win 510, options [nop,nop,TS val 4249369797 ecr 3367776963], length 428
16:18:22.103973 IP (tos 0x88, ttl 128, id 10343, offset 0, flags [DF], proto TCP (6), length 532)
    zoolab.cs.nctu.edu.tw.10001 > 172.28.96.148.34130: Flags [P.], cksum 0xbdbf (correct), seq 149814:150294, ack 1, win 510, options [nop,nop,TS val 4249369797 ecr 3367776963], length 480
16:18:22.103974 IP (tos 0x8c, ttl 132, id 10344, offset 0, flags [DF], proto TCP (6), length 126)
    zoolab.cs.nctu.edu.tw.10001 > 172.28.96.148.34130: Flags [P.], cksum 0x9b06 (correct), seq 150294:150368, ack 1, win 510, options [nop,nop,TS val 4249369797 ecr 3367776963], length 74
16:18:22.104255 IP (tos 0x84, ttl 123, id 10345, offset 0, flags [DF], proto TCP (6), length 249)
    zoolab.cs.nctu.edu.tw.10001 > 172.28.96.148.34130: Flags [P.], cksum 0x8bb1 (correct), seq 150368:150565, ack 1, win 510, options [nop,nop,TS val 4249369797 ecr 3367776963], length 197
16:18:22.104255 IP (tos 0x84, ttl 122, id 10346, offset 0, flags [DF], proto TCP (6), length 586)
    zoolab.cs.nctu.edu.tw.10001 > 172.28.96.148.34130: Flags [P.], cksum 0x7524 (correct), seq 150565:151099, ack 1, win 510, options [nop,nop,TS val 4249369798 ecr 3367776963], length 534
16:18:22.104648 IP (tos 0x88, ttl 129, id 10347, offset 0, flags [DF], proto TCP (6), length 1058)
    zoolab.cs.nctu.edu.tw.10001 > 172.28.96.148.34130: Flags [P.], cksum 0x4921 (correct), seq 151099:152105, ack 1, win 510, options [nop,nop,TS val 4249369798 ecr 3367776964], length 1006
16:18:22.104648 IP (tos 0x84, ttl 125, id 10348, offset 0, flags [DF], proto TCP (6), length 315)
    zoolab.cs.nctu.edu.tw.10001 > 172.28.96.148.34130: Flags [P.], cksum 0x31c8 (correct), seq 152105:152368, ack 1, win 510, options [nop,nop,TS val 4249369798 ecr 3367776964], length 263
16:18:22.105009 IP (tos 0x80, ttl 120, id 10349, offset 0, flags [DF], proto TCP (6), length 335)
    zoolab.cs.nctu.edu.tw.10001 > 172.28.96.148.34130: Flags [P.], cksum 0xf8b3 (correct), seq 152368:152651, ack 1, win 510, options [nop,nop,TS val 4249369798 ecr 3367776964], length 283
16:18:22.105527 IP (tos 0x88, ttl 128, id 10350, offset 0, flags [DF], proto TCP (6), length 801)
    zoolab.cs.nctu.edu.tw.10001 > 172.28.96.148.34130: Flags [P.], cksum 0x63da (correct), seq 152651:153400, ack 1, win 510, options [nop,nop,TS val 4249369798 ecr 3367776964], length 749
16:18:22.105528 IP (tos 0x80, ttl 120, id 10351, offset 0, flags [DF], proto TCP (6), length 144)
    zoolab.cs.nctu.edu.tw.10001 > 172.28.96.148.34130: Flags [P.], cksum 0x276f (correct), seq 153400:153492, ack 1, win 510, options [nop,nop,TS val 4249369799 ecr 3367776965], length 92
16:18:22.105737 IP (tos 0x84, ttl 122, id 10352, offset 0, flags [DF], proto TCP (6), length 321)
    zoolab.cs.nctu.edu.tw.10001 > 172.28.96.148.34130: Flags [P.], cksum 0x3f89 (correct), seq 153492:153761, ack 1, win 510, options [nop,nop,TS val 4249369799 ecr 3367776965], length 269
16:18:22.105737 IP (tos 0x88, ttl 126, id 10353, offset 0, flags [DF], proto TCP (6), length 959)
    zoolab.cs.nctu.edu.tw.10001 > 172.28.96.148.34130: Flags [P.], cksum 0xffe9 (correct), seq 153761:154668, ack 1, win 510, options [nop,nop,TS val 4249369799 ecr 3367776965], length 907
16:18:22.105986 IP (tos 0x80, ttl 118, id 10354, offset 0, flags [DF], proto TCP (6), length 490)
    zoolab.cs.nctu.edu.tw.10001 > 172.28.96.148.34130: Flags [P.], cksum 0x93a3 (correct), seq 154668:155106, ack 1, win 510, options [nop,nop,TS val 4249369799 ecr 3367776965], length 438
16:18:22.105986 IP (tos 0x84, ttl 125, id 10355, offset 0, flags [DF], proto TCP (6), length 504)
    zoolab.cs.nctu.edu.tw.10001 > 172.28.96.148.34130: Flags [P.], cksum 0x4079 (correct), seq 155106:155558, ack 1, win 510, options [nop,nop,TS val 4249369799 ecr 3367776965], length 452
16:18:22.106219 IP (tos 0x84, ttl 124, id 10356, offset 0, flags [DF], proto TCP (6), length 301)
    zoolab.cs.nctu.edu.tw.10001 > 172.28.96.148.34130: Flags [P.], cksum 0xe997 (correct), seq 155558:155807, ack 1, win 510, options [nop,nop,TS val 4249369800 ecr 3367776965], length 249
16:18:22.106627 IP (tos 0x80, ttl 120, id 10357, offset 0, flags [DF], proto TCP (6), length 162)
    zoolab.cs.nctu.edu.tw.10001 > 172.28.96.148.34130: Flags [P.], cksum 0x69aa (correct), seq 155807:155917, ack 1, win 510, options [nop,nop,TS val 4249369800 ecr 3367776966], length 110
16:18:22.106833 IP (tos 0x84, ttl 123, id 10358, offset 0, flags [DF], proto TCP (6), length 781)
    zoolab.cs.nctu.edu.tw.10001 > 172.28.96.148.34130: Flags [P.], cksum 0x5df3 (correct), seq 155917:156646, ack 1, win 510, options [nop,nop,TS val 4249369800 ecr 3367776966], length 729
16:18:22.107041 IP (tos 0x88, ttl 128, id 10359, offset 0, flags [DF], proto TCP (6), length 1124)
    zoolab.cs.nctu.edu.tw.10001 > 172.28.96.148.34130: Flags [P.], cksum 0x0254 (correct), seq 156646:157718, ack 1, win 510, options [nop,nop,TS val 4249369800 ecr 3367776966], length 1072
16:18:22.107790 IP (tos 0x84, ttl 122, id 10360, offset 0, flags [DF], proto TCP (6), length 903)
    zoolab.cs.nctu.edu.tw.10001 > 172.28.96.148.34130: Flags [P.], cksum 0xc211 (correct), seq 157718:158569, ack 1, win 510, options [nop,nop,TS val 4249369800 ecr 3367776966], length 851
16:18:22.107790 IP (tos 0x88, ttl 127, id 10361, offset 0, flags [DF], proto TCP (6), length 609)
    zoolab.cs.nctu.edu.tw.10001 > 172.28.96.148.34130: Flags [P.], cksum 0x8df9 (correct), seq 158569:159126, ack 1, win 510, options [nop,nop,TS val 4249369801 ecr 3367776967], length 557
16:18:22.108246 IP (tos 0x88, ttl 129, id 10362, offset 0, flags [DF], proto TCP (6), length 1043)
    zoolab.cs.nctu.edu.tw.10001 > 172.28.96.148.34130: Flags [P.], cksum 0xb1ab (correct), seq 159126:160117, ack 1, win 510, options [nop,nop,TS val 4249369801 ecr 3367776967], length 991
16:18:22.108440 IP (tos 0x8c, ttl 131, id 10363, offset 0, flags [DF], proto TCP (6), length 904)
    zoolab.cs.nctu.edu.tw.10001 > 172.28.96.148.34130: Flags [P.], cksum 0xcbf1 (correct), seq 160117:160969, ack 1, win 510, options [nop,nop,TS val 4249369801 ecr 3367776967], length 852
16:18:22.108745 IP (tos 0x88, ttl 127, id 10364, offset 0, flags [DF], proto TCP (6), length 512)
    zoolab.cs.nctu.edu.tw.10001 > 172.28.96.148.34130: Flags [P.], cksum 0x66eb (correct), seq 160969:161429, ack 1, win 510, options [nop,nop,TS val 4249369801 ecr 3367776967], length 460
16:18:22.108745 IP (tos 0x88, ttl 129, id 10365, offset 0, flags [DF], proto TCP (6), length 848)
    zoolab.cs.nctu.edu.tw.10001 > 172.28.96.148.34130: Flags [P.], cksum 0x5edd (correct), seq 161429:162225, ack 1, win 510, options [nop,nop,TS val 4249369801 ecr 3367776967], length 796
16:18:22.108955 IP (tos 0x80, ttl 121, id 10366, offset 0, flags [DF], proto TCP (6), length 1079)
    zoolab.cs.nctu.edu.tw.10001 > 172.28.96.148.34130: Flags [P.], cksum 0xfb38 (correct), seq 162225:163252, ack 1, win 510, options [nop,nop,TS val 4249369802 ecr 3367776967], length 1027
16:18:22.108955 IP (tos 0x88, ttl 128, id 10367, offset 0, flags [DF], proto TCP (6), length 814)
    zoolab.cs.nctu.edu.tw.10001 > 172.28.96.148.34130: Flags [P.], cksum 0x825a (correct), seq 163252:164014, ack 1, win 510, options [nop,nop,TS val 4249369802 ecr 3367776967], length 762
16:18:22.109572 IP (tos 0x80, ttl 118, id 10369, offset 0, flags [DF], proto TCP (6), length 165)
    zoolab.cs.nctu.edu.tw.10001 > 172.28.96.148.34130: Flags [P.], cksum 0x1449 (correct), seq 164522:164635, ack 1, win 510, options [nop,nop,TS val 4249369802 ecr 3367776968], length 113
16:18:22.109891 IP (tos 0x84, ttl 125, id 10368, offset 0, flags [DF], proto TCP (6), length 560)
    zoolab.cs.nctu.edu.tw.10001 > 172.28.96.148.34130: Flags [P.], cksum 0x3156 (correct), seq 164014:164522, ack 1, win 510, options [nop,nop,TS val 4249369802 ecr 3367776968], length 508
16:18:22.109892 IP (tos 0x84, ttl 125, id 10370, offset 0, flags [DF], proto TCP (6), length 1055)
    zoolab.cs.nctu.edu.tw.10001 > 172.28.96.148.34130: Flags [P.], cksum 0x0a54 (correct), seq 164635:165638, ack 1, win 510, options [nop,nop,TS val 4249369802 ecr 3367776968], length 1003
16:18:22.110094 IP (tos 0x88, ttl 127, id 10371, offset 0, flags [DF], proto TCP (6), length 436)
    zoolab.cs.nctu.edu.tw.10001 > 172.28.96.148.34130: Flags [P.], cksum 0x34e6 (correct), seq 165638:166022, ack 1, win 510, options [nop,nop,TS val 4249369802 ecr 3367776969], length 384
16:18:22.110094 IP (tos 0x88, ttl 127, id 10372, offset 0, flags [DF], proto TCP (6), length 493)
    zoolab.cs.nctu.edu.tw.10001 > 172.28.96.148.34130: Flags [P.], cksum 0x5d4c (correct), seq 166022:166463, ack 1, win 510, options [nop,nop,TS val 4249369803 ecr 3367776969], length 441
16:18:22.110400 IP (tos 0x84, ttl 123, id 10373, offset 0, flags [DF], proto TCP (6), length 568)
    zoolab.cs.nctu.edu.tw.10001 > 172.28.96.148.34130: Flags [P.], cksum 0x4e86 (correct), seq 166463:166979, ack 1, win 510, options [nop,nop,TS val 4249369803 ecr 3367776969], length 516
16:18:22.110400 IP (tos 0x84, ttl 124, id 10374, offset 0, flags [DF], proto TCP (6), length 1077)
    zoolab.cs.nctu.edu.tw.10001 > 172.28.96.148.34130: Flags [P.], cksum 0x6b0f (correct), seq 166979:168004, ack 1, win 510, options [nop,nop,TS val 4249369803 ecr 3367776969], length 1025
16:18:22.110401 IP (tos 0x8c, ttl 130, id 10375, offset 0, flags [DF], proto TCP (6), length 1007)
    zoolab.cs.nctu.edu.tw.10001 > 172.28.96.148.34130: Flags [P.], cksum 0x37e8 (correct), seq 168004:168959, ack 1, win 510, options [nop,nop,TS val 4249369803 ecr 3367776969], length 955
16:18:22.110401 IP (tos 0x88, ttl 129, id 10376, offset 0, flags [DF], proto TCP (6), length 490)
    zoolab.cs.nctu.edu.tw.10001 > 172.28.96.148.34130: Flags [P.], cksum 0xf0b8 (correct), seq 168959:169397, ack 1, win 510, options [nop,nop,TS val 4249369803 ecr 3367776969], length 438
16:18:22.110784 IP (tos 0x88, ttl 126, id 10377, offset 0, flags [DF], proto TCP (6), length 1022)
    zoolab.cs.nctu.edu.tw.10001 > 172.28.96.148.34130: Flags [P.], cksum 0x21a9 (correct), seq 169397:170367, ack 1, win 510, options [nop,nop,TS val 4249369804 ecr 3367776969], length 970
16:18:22.110784 IP (tos 0x88, ttl 126, id 10378, offset 0, flags [DF], proto TCP (6), length 560)
    zoolab.cs.nctu.edu.tw.10001 > 172.28.96.148.34130: Flags [P.], cksum 0x3152 (correct), seq 164014:164522, ack 1, win 510, options [nop,nop,TS val 4249369804 ecr 3367776970], length 508
16:18:22.111069 IP (tos 0x8c, ttl 133, id 10379, offset 0, flags [DF], proto TCP (6), length 2495)
    zoolab.cs.nctu.edu.tw.10001 > 172.28.96.148.34130: Flags [P.], cksum 0x78a9 (incorrect -> 0x8e49), seq 170367:172810, ack 1, win 510, options [nop,nop,TS val 4249369804 ecr 3367776970], length 2443
16:18:22.111282 IP (tos 0x84, ttl 125, id 10381, offset 0, flags [DF], proto TCP (6), length 1015)
    zoolab.cs.nctu.edu.tw.10001 > 172.28.96.148.34130: Flags [P.], cksum 0xc14e (correct), seq 172810:173773, ack 1, win 510, options [nop,nop,TS val 4249369804 ecr 3367776970], length 963
16:18:22.111503 IP (tos 0x8c, ttl 132, id 10382, offset 0, flags [DF], proto TCP (6), length 1040)
    zoolab.cs.nctu.edu.tw.10001 > 172.28.96.148.34130: Flags [P.], cksum 0x2659 (correct), seq 173773:174761, ack 1, win 510, options [nop,nop,TS val 4249369805 ecr 3367776971], length 988
16:18:22.111503 IP (tos 0x88, ttl 127, id 10383, offset 0, flags [DF], proto TCP (6), length 298)
    zoolab.cs.nctu.edu.tw.10001 > 172.28.96.148.34130: Flags [P.], cksum 0x497c (correct), seq 174761:175007, ack 1, win 510, options [nop,nop,TS val 4249369805 ecr 3367776971], length 246
16:18:22.111769 IP (tos 0x80, ttl 118, id 10384, offset 0, flags [DF], proto TCP (6), length 655)
    zoolab.cs.nctu.edu.tw.10001 > 172.28.96.148.34130: Flags [P.], cksum 0xed38 (correct), seq 175007:175610, ack 1, win 510, options [nop,nop,TS val 4249369805 ecr 3367776971], length 603
16:18:22.111770 IP (tos 0x80, ttl 121, id 10385, offset 0, flags [DF], proto TCP (6), length 437)
    zoolab.cs.nctu.edu.tw.10001 > 172.28.96.148.34130: Flags [P.], cksum 0xd699 (correct), seq 175610:175995, ack 1, win 510, options [nop,nop,TS val 4249369805 ecr 3367776971], length 385
16:18:22.112022 IP (tos 0x88, ttl 127, id 10386, offset 0, flags [DF], proto TCP (6), length 1057)
    zoolab.cs.nctu.edu.tw.10001 > 172.28.96.148.34130: Flags [P.], cksum 0x9264 (correct), seq 175995:177000, ack 1, win 510, options [nop,nop,TS val 4249369805 ecr 3367776971], length 1005
16:18:22.112227 IP (tos 0x88, ttl 128, id 10387, offset 0, flags [DF], proto TCP (6), length 652)
    zoolab.cs.nctu.edu.tw.10001 > 172.28.96.148.34130: Flags [P.], cksum 0x5b4d (correct), seq 177000:177600, ack 1, win 510, options [nop,nop,TS val 4249369805 ecr 3367776971], length 600
16:18:22.112271 IP (tos 0x84, ttl 124, id 10388, offset 0, flags [DF], proto TCP (6), length 292)
    zoolab.cs.nctu.edu.tw.10001 > 172.28.96.148.34130: Flags [P.], cksum 0xe0bc (correct), seq 177600:177840, ack 1, win 510, options [nop,nop,TS val 4249369806 ecr 3367776972], length 240
