11:35:37.772882 IP (tos 0x0, ttl 64, id 0, offset 0, flags [DF], proto TCP (6), length 64)
    10.2.1.238.50163 > zoolab.cs.nctu.edu.tw.10001: Flags [S], cksum 0x8262 (correct), seq 1746690473, win 65535, options [mss 1460,nop,wscale 6,nop,nop,TS val 2265451152 ecr 0,sackOK,eol], length 0
11:35:37.797049 IP (tos 0x0, ttl 49, id 0, offset 0, flags [DF], proto TCP (6), length 60)
    zoolab.cs.nctu.edu.tw.10001 > 10.2.1.238.50163: Flags [S.], cksum 0x1a88 (correct), seq 3082486443, ack 1746690474, win 65160, options [mss 1386,sackOK,TS val 2237938371 ecr 2265451152,nop,wscale 7], length 0
11:35:37.797074 IP (tos 0x0, ttl 64, id 0, offset 0, flags [DF], proto TCP (6), length 52)
    10.2.1.238.50163 > zoolab.cs.nctu.edu.tw.10001: Flags [.], cksum 0x3f6e (correct), ack 1, win 2061, options [nop,nop,TS val 2265451176 ecr 2237938371], length 0
11:35:37.804216 IP (tos 0x0, ttl 114, id 16311, offset 0, flags [DF], proto TCP (6), length 710)
    zoolab.cs.nctu.edu.tw.10001 > 10.2.1.238.50163: Flags [P.], cksum 0xfc67 (correct), seq 1:659, ack 1, win 510, options [nop,nop,TS val 2237938378 ecr 2265451176], length 658
11:35:37.804217 IP (tos 0x0, ttl 127, id 16312, offset 0, flags [DF], proto TCP (6), length 122)
    zoolab.cs.nctu.edu.tw.10001 > 10.2.1.238.50163: Flags [P.], cksum 0x2402 (correct), seq 659:729, ack 1, win 510, options [nop,nop,TS val 2237938378 ecr 2265451176], length 70
11:35:37.804274 IP (tos 0x0, ttl 64, id 0, offset 0, flags [DF], proto TCP (6), length 52)
    10.2.1.238.50163 > zoolab.cs.nctu.edu.tw.10001: Flags [.], cksum 0x3cd9 (correct), ack 659, win 2050, options [nop,nop,TS val 2265451183 ecr 2237938378], length 0
11:35:37.804296 IP (tos 0x0, ttl 64, id 0, offset 0, flags [DF], proto TCP (6), length 52)
    10.2.1.238.50163 > zoolab.cs.nctu.edu.tw.10001: Flags [.], cksum 0x3c94 (correct), ack 729, win 2049, options [nop,nop,TS val 2265451183 ecr 2237938378], length 0
11:35:37.807114 IP (tos 0x0, ttl 123, id 16313, offset 0, flags [DF], proto TCP (6), length 1041)
    zoolab.cs.nctu.edu.tw.10001 > 10.2.1.238.50163: Flags [P.], cksum 0xf3a6 (correct), seq 729:1718, ack 1, win 510, options [nop,nop,TS val 2237938378 ecr 2265451176], length 989
11:35:37.807114 IP (tos 0x0, ttl 123, id 16314, offset 0, flags [DF], proto TCP (6), length 1002)
    zoolab.cs.nctu.edu.tw.10001 > 10.2.1.238.50163: Flags [P.], cksum 0xbbe9 (correct), seq 1718:2668, ack 1, win 510, options [nop,nop,TS val 2237938378 ecr 2265451176], length 950
11:35:37.807115 IP (tos 0x0, ttl 120, id 16315, offset 0, flags [DF], proto TCP (6), length 827)
    zoolab.cs.nctu.edu.tw.10001 > 10.2.1.238.50163: Flags [P.], cksum 0x239b (correct), seq 2668:3443, ack 1, win 510, options [nop,nop,TS val 2237938379 ecr 2265451176], length 775
11:35:37.807115 IP (tos 0x0, ttl 124, id 16316, offset 0, flags [DF], proto TCP (6), length 133)
    zoolab.cs.nctu.edu.tw.10001 > 10.2.1.238.50163: Flags [P.], cksum 0x3451 (correct), seq 3443:3524, ack 1, win 510, options [nop,nop,TS val 2237938379 ecr 2265451176], length 81
11:35:37.807116 IP (tos 0x0, ttl 115, id 16317, offset 0, flags [DF], proto TCP (6), length 901)
    zoolab.cs.nctu.edu.tw.10001 > 10.2.1.238.50163: Flags [P.], cksum 0x0e4a (correct), seq 3524:4373, ack 1, win 510, options [nop,nop,TS val 2237938379 ecr 2265451176], length 849
11:35:37.807116 IP (tos 0x0, ttl 113, id 16318, offset 0, flags [DF], proto TCP (6), length 561)
    zoolab.cs.nctu.edu.tw.10001 > 10.2.1.238.50163: Flags [P.], cksum 0x6da6 (correct), seq 4373:4882, ack 1, win 510, options [nop,nop,TS val 2237938379 ecr 2265451176], length 509
11:35:37.807116 IP (tos 0x0, ttl 122, id 16319, offset 0, flags [DF], proto TCP (6), length 364)
    zoolab.cs.nctu.edu.tw.10001 > 10.2.1.238.50163: Flags [P.], cksum 0xa34d (correct), seq 4882:5194, ack 1, win 510, options [nop,nop,TS val 2237938379 ecr 2265451176], length 312
11:35:37.807116 IP (tos 0x0, ttl 115, id 16320, offset 0, flags [DF], proto TCP (6), length 451)
    zoolab.cs.nctu.edu.tw.10001 > 10.2.1.238.50163: Flags [P.], cksum 0xa462 (correct), seq 5194:5593, ack 1, win 510, options [nop,nop,TS val 2237938380 ecr 2265451176], length 399
11:35:37.807147 IP (tos 0x0, ttl 64, id 0, offset 0, flags [DF], proto TCP (6), length 52)
    10.2.1.238.50163 > zoolab.cs.nctu.edu.tw.10001: Flags [.], cksum 0x351c (correct), ack 2668, win 2019, options [nop,nop,TS val 2265451186 ecr 2237938378], length 0
11:35:37.807181 IP (tos 0x0, ttl 64, id 0, offset 0, flags [DF], proto TCP (6), length 52)
    10.2.1.238.50163 > zoolab.cs.nctu.edu.tw.10001: Flags [.], cksum 0x3220 (correct), ack 3443, win 2007, options [nop,nop,TS val 2265451186 ecr 2237938379], length 0
11:35:37.807245 IP (tos 0x0, ttl 64, id 0, offset 0, flags [DF], proto TCP (6), length 52)
    10.2.1.238.50163 > zoolab.cs.nctu.edu.tw.10001: Flags [.], cksum 0x31a8 (correct), ack 3524, win 2046, options [nop,nop,TS val 2265451186 ecr 2237938379], length 0
11:35:37.807260 IP (tos 0x0, ttl 64, id 0, offset 0, flags [DF], proto TCP (6), length 52)
    10.2.1.238.50163 > zoolab.cs.nctu.edu.tw.10001: Flags [.], cksum 0x2e64 (correct), ack 4373, win 2033, options [nop,nop,TS val 2265451186 ecr 2237938379], length 0
11:35:37.807263 IP (tos 0x0, ttl 64, id 0, offset 0, flags [DF], proto TCP (6), length 52)
    10.2.1.238.50163 > zoolab.cs.nctu.edu.tw.10001: Flags [.], cksum 0x2c6f (correct), ack 4882, win 2025, options [nop,nop,TS val 2265451186 ecr 2237938379], length 0
11:35:37.807268 IP (tos 0x0, ttl 64, id 0, offset 0, flags [DF], proto TCP (6), length 52)
    10.2.1.238.50163 > zoolab.cs.nctu.edu.tw.10001: Flags [.], cksum 0x2b3c (correct), ack 5194, win 2020, options [nop,nop,TS val 2265451186 ecr 2237938379], length 0
11:35:37.807271 IP (tos 0x0, ttl 64, id 0, offset 0, flags [DF], proto TCP (6), length 52)
    10.2.1.238.50163 > zoolab.cs.nctu.edu.tw.10001: Flags [.], cksum 0x29b2 (correct), ack 5593, win 2014, options [nop,nop,TS val 2265451186 ecr 2237938380], length 0
11:35:37.810474 IP (tos 0x0, ttl 122, id 16321, offset 0, flags [DF], proto TCP (6), length 1434)
    zoolab.cs.nctu.edu.tw.10001 > 10.2.1.238.50163: Flags [.], cksum 0xe7ee (correct), seq 5593:6975, ack 1, win 510, options [nop,nop,TS val 2237938384 ecr 2265451183], length 1382
11:35:37.810474 IP (tos 0x0, ttl 122, id 16322, offset 0, flags [DF], proto TCP (6), length 1434)
    zoolab.cs.nctu.edu.tw.10001 > 10.2.1.238.50163: Flags [P.], cksum 0xfef9 (correct), seq 6975:8357, ack 1, win 510, options [nop,nop,TS val 2237938384 ecr 2265451183], length 1382
11:35:37.810504 IP (tos 0x0, ttl 64, id 0, offset 0, flags [DF], proto TCP (6), length 52)
    10.2.1.238.50163 > zoolab.cs.nctu.edu.tw.10001: Flags [.], cksum 0x1ee8 (correct), ack 8357, win 2004, options [nop,nop,TS val 2265451190 ecr 2237938384], length 0
11:35:37.810575 IP (tos 0x0, ttl 64, id 0, offset 0, flags [DF], proto TCP (6), length 52)
    10.2.1.238.50163 > zoolab.cs.nctu.edu.tw.10001: Flags [.], cksum 0x1ebc (correct), ack 8357, win 2048, options [nop,nop,TS val 2265451190 ecr 2237938384], length 0
11:35:37.811764 IP (tos 0x0, ttl 120, id 16323, offset 0, flags [DF], proto TCP (6), length 1434)
    zoolab.cs.nctu.edu.tw.10001 > 10.2.1.238.50163: Flags [.], cksum 0xeb45 (correct), seq 8357:9739, ack 1, win 510, options [nop,nop,TS val 2237938385 ecr 2265451183], length 1382
11:35:37.811765 IP (tos 0x0, ttl 120, id 16324, offset 0, flags [DF], proto TCP (6), length 1434)
    zoolab.cs.nctu.edu.tw.10001 > 10.2.1.238.50163: Flags [P.], cksum 0xb32a (correct), seq 9739:11121, ack 1, win 510, options [nop,nop,TS val 2237938385 ecr 2265451183], length 1382
11:35:37.811790 IP (tos 0x0, ttl 64, id 0, offset 0, flags [DF], proto TCP (6), length 52)
    10.2.1.238.50163 > zoolab.cs.nctu.edu.tw.10001: Flags [.], cksum 0x141a (correct), ack 11121, win 2004, options [nop,nop,TS val 2265451191 ecr 2237938385], length 0
11:35:37.811826 IP (tos 0x0, ttl 64, id 0, offset 0, flags [DF], proto TCP (6), length 52)
    10.2.1.238.50163 > zoolab.cs.nctu.edu.tw.10001: Flags [.], cksum 0x13ee (correct), ack 11121, win 2048, options [nop,nop,TS val 2265451191 ecr 2237938385], length 0
11:35:37.814152 IP (tos 0x0, ttl 124, id 16329, offset 0, flags [DF], proto TCP (6), length 1434)
    zoolab.cs.nctu.edu.tw.10001 > 10.2.1.238.50163: Flags [.], cksum 0x7197 (correct), seq 16649:18031, ack 1, win 510, options [nop,nop,TS val 2237938387 ecr 2265451186], length 1382
11:35:37.814152 IP (tos 0x0, ttl 124, id 16330, offset 0, flags [DF], proto TCP (6), length 1434)
    zoolab.cs.nctu.edu.tw.10001 > 10.2.1.238.50163: Flags [.], cksum 0xb969 (correct), seq 18031:19413, ack 1, win 510, options [nop,nop,TS val 2237938387 ecr 2265451186], length 1382
11:35:37.814153 IP (tos 0x0, ttl 124, id 16331, offset 0, flags [DF], proto TCP (6), length 1434)
    zoolab.cs.nctu.edu.tw.10001 > 10.2.1.238.50163: Flags [.], cksum 0xcfdc (correct), seq 19413:20795, ack 1, win 510, options [nop,nop,TS val 2237938387 ecr 2265451186], length 1382
11:35:37.814160 IP (tos 0x0, ttl 124, id 16332, offset 0, flags [DF], proto TCP (6), length 1434)
    zoolab.cs.nctu.edu.tw.10001 > 10.2.1.238.50163: Flags [.], cksum 0x97e2 (correct), seq 20795:22177, ack 1, win 510, options [nop,nop,TS val 2237938387 ecr 2265451186], length 1382
11:35:37.814161 IP (tos 0x0, ttl 124, id 16333, offset 0, flags [DF], proto TCP (6), length 1434)
    zoolab.cs.nctu.edu.tw.10001 > 10.2.1.238.50163: Flags [P.], cksum 0x1ed8 (correct), seq 22177:23559, ack 1, win 510, options [nop,nop,TS val 2237938387 ecr 2265451186], length 1382
11:35:37.814184 IP (tos 0x0, ttl 64, id 0, offset 0, flags [DF], proto TCP (6), length 64)
    10.2.1.238.50163 > zoolab.cs.nctu.edu.tw.10001: Flags [.], cksum 0xd6c2 (correct), ack 11121, win 2048, options [nop,nop,TS val 2265451193 ecr 2237938385,nop,nop,sack 1 {16649:20795}], length 0
11:35:37.814211 IP (tos 0x0, ttl 64, id 0, offset 0, flags [DF], proto TCP (6), length 64)
    10.2.1.238.50163 > zoolab.cs.nctu.edu.tw.10001: Flags [.], cksum 0xcbf6 (correct), ack 11121, win 2048, options [nop,nop,TS val 2265451193 ecr 2237938385,nop,nop,sack 1 {16649:23559}], length 0
11:35:37.817487 IP (tos 0x0, ttl 118, id 16325, offset 0, flags [DF], proto TCP (6), length 1434)
    zoolab.cs.nctu.edu.tw.10001 > 10.2.1.238.50163: Flags [.], cksum 0x0d9d (correct), seq 11121:12503, ack 1, win 510, options [nop,nop,TS val 2237938387 ecr 2265451186], length 1382
11:35:37.817487 IP (tos 0x0, ttl 118, id 16326, offset 0, flags [DF], proto TCP (6), length 1434)
    zoolab.cs.nctu.edu.tw.10001 > 10.2.1.238.50163: Flags [.], cksum 0x783b (correct), seq 12503:13885, ack 1, win 510, options [nop,nop,TS val 2237938387 ecr 2265451186], length 1382
11:35:37.817488 IP (tos 0x0, ttl 118, id 16327, offset 0, flags [DF], proto TCP (6), length 1434)
    zoolab.cs.nctu.edu.tw.10001 > 10.2.1.238.50163: Flags [.], cksum 0xed20 (correct), seq 13885:15267, ack 1, win 510, options [nop,nop,TS val 2237938387 ecr 2265451186], length 1382
11:35:37.817523 IP (tos 0x0, ttl 64, id 0, offset 0, flags [DF], proto TCP (6), length 64)
    10.2.1.238.50163 > zoolab.cs.nctu.edu.tw.10001: Flags [.], cksum 0xbbff (correct), ack 15267, win 1983, options [nop,nop,TS val 2265451197 ecr 2237938387,nop,nop,sack 1 {16649:23559}], length 0
11:35:37.817581 IP (tos 0x0, ttl 64, id 0, offset 0, flags [DF], proto TCP (6), length 64)
    10.2.1.238.50163 > zoolab.cs.nctu.edu.tw.10001: Flags [.], cksum 0xbbbe (correct), ack 15267, win 2048, options [nop,nop,TS val 2265451197 ecr 2237938387,nop,nop,sack 1 {16649:23559}], length 0
11:35:37.817623 IP (tos 0x0, ttl 118, id 16328, offset 0, flags [DF], proto TCP (6), length 1434)
    zoolab.cs.nctu.edu.tw.10001 > 10.2.1.238.50163: Flags [P.], cksum 0x6743 (correct), seq 15267:16649, ack 1, win 510, options [nop,nop,TS val 2237938387 ecr 2265451186], length 1382
11:35:37.817624 IP (tos 0x0, ttl 124, id 16334, offset 0, flags [DF], proto TCP (6), length 1434)
    zoolab.cs.nctu.edu.tw.10001 > 10.2.1.238.50163: Flags [.], cksum 0xe607 (correct), seq 23559:24941, ack 1, win 510, options [nop,nop,TS val 2237938387 ecr 2265451186], length 1382
11:35:37.817624 IP (tos 0x0, ttl 124, id 16335, offset 0, flags [DF], proto TCP (6), length 1348)
    zoolab.cs.nctu.edu.tw.10001 > 10.2.1.238.50163: Flags [P.], cksum 0x58e7 (correct), seq 24941:26237, ack 1, win 510, options [nop,nop,TS val 2237938387 ecr 2265451186], length 1296
11:35:37.817638 IP (tos 0x0, ttl 64, id 0, offset 0, flags [DF], proto TCP (6), length 52)
    10.2.1.238.50163 > zoolab.cs.nctu.edu.tw.10001: Flags [.], cksum 0xe3d1 (correct), ack 23559, win 1918, options [nop,nop,TS val 2265451197 ecr 2237938387], length 0
11:35:37.817651 IP (tos 0x0, ttl 64, id 0, offset 0, flags [DF], proto TCP (6), length 52)
    10.2.1.238.50163 > zoolab.cs.nctu.edu.tw.10001: Flags [.], cksum 0xd985 (correct), ack 26237, win 1876, options [nop,nop,TS val 2265451197 ecr 2237938387], length 0
11:35:37.817739 IP (tos 0x0, ttl 64, id 0, offset 0, flags [DF], proto TCP (6), length 52)
    10.2.1.238.50163 > zoolab.cs.nctu.edu.tw.10001: Flags [.], cksum 0xd8d9 (correct), ack 26237, win 2048, options [nop,nop,TS val 2265451197 ecr 2237938387], length 0
11:35:37.818748 IP (tos 0x0, ttl 124, id 16336, offset 0, flags [DF], proto TCP (6), length 704)
    zoolab.cs.nctu.edu.tw.10001 > 10.2.1.238.50163: Flags [P.], cksum 0xf0b8 (correct), seq 26237:26889, ack 1, win 510, options [nop,nop,TS val 2237938387 ecr 2265451186], length 652
11:35:37.818749 IP (tos 0x0, ttl 127, id 16337, offset 0, flags [DF], proto TCP (6), length 823)
    zoolab.cs.nctu.edu.tw.10001 > 10.2.1.238.50163: Flags [P.], cksum 0x435c (correct), seq 26889:27660, ack 1, win 510, options [nop,nop,TS val 2237938387 ecr 2265451186], length 771
11:35:37.818750 IP (tos 0x0, ttl 127, id 16338, offset 0, flags [DF], proto TCP (6), length 561)
    zoolab.cs.nctu.edu.tw.10001 > 10.2.1.238.50163: Flags [P.], cksum 0xf245 (correct), seq 27660:28169, ack 1, win 510, options [nop,nop,TS val 2237938387 ecr 2265451186], length 509
11:35:37.818750 IP (tos 0x0, ttl 123, id 16339, offset 0, flags [DF], proto TCP (6), length 405)
    zoolab.cs.nctu.edu.tw.10001 > 10.2.1.238.50163: Flags [P.], cksum 0x847f (correct), seq 28169:28522, ack 1, win 510, options [nop,nop,TS val 2237938387 ecr 2265451186], length 353
11:35:37.818750 IP (tos 0x0, ttl 116, id 16340, offset 0, flags [DF], proto TCP (6), length 431)
    zoolab.cs.nctu.edu.tw.10001 > 10.2.1.238.50163: Flags [P.], cksum 0x9e89 (correct), seq 28522:28901, ack 1, win 510, options [nop,nop,TS val 2237938387 ecr 2265451186], length 379
11:35:37.818793 IP (tos 0x0, ttl 64, id 0, offset 0, flags [DF], proto TCP (6), length 52)
    10.2.1.238.50163 > zoolab.cs.nctu.edu.tw.10001: Flags [.], cksum 0xd657 (correct), ack 26889, win 2037, options [nop,nop,TS val 2265451198 ecr 2237938387], length 0
11:35:37.818838 IP (tos 0x0, ttl 64, id 0, offset 0, flags [DF], proto TCP (6), length 52)
    10.2.1.238.50163 > zoolab.cs.nctu.edu.tw.10001: Flags [.], cksum 0xd16b (correct), ack 28169, win 2017, options [nop,nop,TS val 2265451198 ecr 2237938387], length 0
11:35:37.818858 IP (tos 0x0, ttl 64, id 0, offset 0, flags [DF], proto TCP (6), length 52)
    10.2.1.238.50163 > zoolab.cs.nctu.edu.tw.10001: Flags [.], cksum 0xd00f (correct), ack 28522, win 2012, options [nop,nop,TS val 2265451198 ecr 2237938387], length 0
11:35:37.818871 IP (tos 0x0, ttl 64, id 0, offset 0, flags [DF], proto TCP (6), length 52)
    10.2.1.238.50163 > zoolab.cs.nctu.edu.tw.10001: Flags [.], cksum 0xce76 (correct), ack 28901, win 2042, options [nop,nop,TS val 2265451198 ecr 2237938387], length 0
11:35:37.819998 IP (tos 0x0, ttl 115, id 16341, offset 0, flags [DF], proto TCP (6), length 1434)
    zoolab.cs.nctu.edu.tw.10001 > 10.2.1.238.50163: Flags [.], cksum 0xc82a (correct), seq 28901:30283, ack 1, win 510, options [nop,nop,TS val 2237938392 ecr 2265451190], length 1382
11:35:37.819998 IP (tos 0x0, ttl 115, id 16342, offset 0, flags [DF], proto TCP (6), length 1434)
    zoolab.cs.nctu.edu.tw.10001 > 10.2.1.238.50163: Flags [.], cksum 0x360a (correct), seq 30283:31665, ack 1, win 510, options [nop,nop,TS val 2237938392 ecr 2265451190], length 1382
11:35:37.819999 IP (tos 0x0, ttl 115, id 16343, offset 0, flags [DF], proto TCP (6), length 1434)
    zoolab.cs.nctu.edu.tw.10001 > 10.2.1.238.50163: Flags [.], cksum 0x6166 (correct), seq 31665:33047, ack 1, win 510, options [nop,nop,TS val 2237938392 ecr 2265451190], length 1382
11:35:37.820042 IP (tos 0x0, ttl 64, id 0, offset 0, flags [DF], proto TCP (6), length 52)
    10.2.1.238.50163 > zoolab.cs.nctu.edu.tw.10001: Flags [.], cksum 0xbe79 (correct), ack 33047, win 1983, options [nop,nop,TS val 2265451199 ecr 2237938392], length 0
11:35:37.820104 IP (tos 0x0, ttl 115, id 16344, offset 0, flags [DF], proto TCP (6), length 1434)
    zoolab.cs.nctu.edu.tw.10001 > 10.2.1.238.50163: Flags [P.], cksum 0x0e3f (correct), seq 33047:34429, ack 1, win 510, options [nop,nop,TS val 2237938392 ecr 2265451190], length 1382
11:35:37.820105 IP (tos 0x0, ttl 128, id 16345, offset 0, flags [DF], proto TCP (6), length 1434)
    zoolab.cs.nctu.edu.tw.10001 > 10.2.1.238.50163: Flags [.], cksum 0x5ebc (correct), seq 34429:35811, ack 1, win 510, options [nop,nop,TS val 2237938393 ecr 2265451191], length 1382
11:35:37.820105 IP (tos 0x0, ttl 128, id 16346, offset 0, flags [DF], proto TCP (6), length 1434)
    zoolab.cs.nctu.edu.tw.10001 > 10.2.1.238.50163: Flags [.], cksum 0x705f (correct), seq 35811:37193, ack 1, win 510, options [nop,nop,TS val 2237938393 ecr 2265451191], length 1382
11:35:37.820126 IP (tos 0x0, ttl 64, id 0, offset 0, flags [DF], proto TCP (6), length 52)
    10.2.1.238.50163 > zoolab.cs.nctu.edu.tw.10001: Flags [.], cksum 0xb929 (correct), ack 34429, win 1961, options [nop,nop,TS val 2265451199 ecr 2237938392], length 0
11:35:37.820146 IP (tos 0x0, ttl 64, id 0, offset 0, flags [DF], proto TCP (6), length 52)
    10.2.1.238.50163 > zoolab.cs.nctu.edu.tw.10001: Flags [.], cksum 0xb8d2 (correct), ack 34429, win 2048, options [nop,nop,TS val 2265451199 ecr 2237938392], length 0
11:35:37.820154 IP (tos 0x0, ttl 64, id 0, offset 0, flags [DF], proto TCP (6), length 52)
    10.2.1.238.50163 > zoolab.cs.nctu.edu.tw.10001: Flags [.], cksum 0xae31 (correct), ack 37193, win 2004, options [nop,nop,TS val 2265451199 ecr 2237938393], length 0
11:35:37.820262 IP (tos 0x0, ttl 64, id 0, offset 0, flags [DF], proto TCP (6), length 52)
    10.2.1.238.50163 > zoolab.cs.nctu.edu.tw.10001: Flags [.], cksum 0xae05 (correct), ack 37193, win 2048, options [nop,nop,TS val 2265451199 ecr 2237938393], length 0
11:35:37.820488 IP (tos 0x0, ttl 128, id 16347, offset 0, flags [DF], proto TCP (6), length 1434)
    zoolab.cs.nctu.edu.tw.10001 > 10.2.1.238.50163: Flags [.], cksum 0x0a52 (correct), seq 37193:38575, ack 1, win 510, options [nop,nop,TS val 2237938393 ecr 2265451191], length 1382
11:35:37.820489 IP (tos 0x0, ttl 128, id 16348, offset 0, flags [DF], proto TCP (6), length 1434)
    zoolab.cs.nctu.edu.tw.10001 > 10.2.1.238.50163: Flags [P.], cksum 0x838d (correct), seq 38575:39957, ack 1, win 510, options [nop,nop,TS val 2237938393 ecr 2265451191], length 1382
11:35:37.820490 IP (tos 0x0, ttl 120, id 16349, offset 0, flags [DF], proto TCP (6), length 1434)
    zoolab.cs.nctu.edu.tw.10001 > 10.2.1.238.50163: Flags [.], cksum 0x0d8f (correct), seq 11121:12503, ack 1, win 510, options [nop,nop,TS val 2237938394 ecr 2265451193], length 1382
11:35:37.820511 IP (tos 0x0, ttl 64, id 0, offset 0, flags [DF], proto TCP (6), length 52)
    10.2.1.238.50163 > zoolab.cs.nctu.edu.tw.10001: Flags [.], cksum 0xa365 (correct), ack 39957, win 2004, options [nop,nop,TS val 2265451199 ecr 2237938393], length 0
11:35:37.820534 IP (tos 0x0, ttl 64, id 0, offset 0, flags [DF], proto TCP (6), length 64)
    10.2.1.238.50163 > zoolab.cs.nctu.edu.tw.10001: Flags [.], cksum 0x9c38 (correct), ack 39957, win 2004, options [nop,nop,TS val 2265451199 ecr 2237938393,nop,nop,sack 1 {11121:12503}], length 0
11:35:37.820583 IP (tos 0x0, ttl 64, id 0, offset 0, flags [DF], proto TCP (6), length 52)
    10.2.1.238.50163 > zoolab.cs.nctu.edu.tw.10001: Flags [.], cksum 0xa339 (correct), ack 39957, win 2048, options [nop,nop,TS val 2265451199 ecr 2237938393], length 0
11:35:37.820772 IP (tos 0x0, ttl 120, id 16350, offset 0, flags [DF], proto TCP (6), length 1434)
    zoolab.cs.nctu.edu.tw.10001 > 10.2.1.238.50163: Flags [P.], cksum 0x7825 (correct), seq 12503:13885, ack 1, win 510, options [nop,nop,TS val 2237938394 ecr 2265451193], length 1382
11:35:37.820773 IP (tos 0x0, ttl 120, id 16351, offset 0, flags [DF], proto TCP (6), length 1434)
    zoolab.cs.nctu.edu.tw.10001 > 10.2.1.238.50163: Flags [.], cksum 0xed12 (correct), seq 13885:15267, ack 1, win 510, options [nop,nop,TS val 2237938394 ecr 2265451193], length 1382
11:35:37.820774 IP (tos 0x0, ttl 120, id 16352, offset 0, flags [DF], proto TCP (6), length 1434)
    zoolab.cs.nctu.edu.tw.10001 > 10.2.1.238.50163: Flags [P.], cksum 0x6735 (correct), seq 15267:16649, ack 1, win 510, options [nop,nop,TS val 2237938394 ecr 2265451193], length 1382
11:35:37.820789 IP (tos 0x0, ttl 64, id 0, offset 0, flags [DF], proto TCP (6), length 64)
    10.2.1.238.50163 > zoolab.cs.nctu.edu.tw.10001: Flags [.], cksum 0x8674 (correct), ack 39957, win 2048, options [nop,nop,TS val 2265451199 ecr 2237938393,nop,nop,sack 1 {12503:16649}], length 0
11:35:37.823398 IP (tos 0x0, ttl 113, id 16353, offset 0, flags [DF], proto TCP (6), length 1434)
    zoolab.cs.nctu.edu.tw.10001 > 10.2.1.238.50163: Flags [.], cksum 0x2003 (correct), seq 39957:41339, ack 1, win 510, options [nop,nop,TS val 2237938397 ecr 2265451197], length 1382
11:35:37.823398 IP (tos 0x0, ttl 113, id 16354, offset 0, flags [DF], proto TCP (6), length 1434)
    zoolab.cs.nctu.edu.tw.10001 > 10.2.1.238.50163: Flags [.], cksum 0x6837 (correct), seq 41339:42721, ack 1, win 510, options [nop,nop,TS val 2237938397 ecr 2265451197], length 1382
11:35:37.823399 IP (tos 0x0, ttl 113, id 16355, offset 0, flags [DF], proto TCP (6), length 1434)
    zoolab.cs.nctu.edu.tw.10001 > 10.2.1.238.50163: Flags [.], cksum 0x5a1f (correct), seq 42721:44103, ack 1, win 510, options [nop,nop,TS val 2237938397 ecr 2265451197], length 1382
11:35:37.823452 IP (tos 0x0, ttl 64, id 0, offset 0, flags [DF], proto TCP (6), length 52)
    10.2.1.238.50163 > zoolab.cs.nctu.edu.tw.10001: Flags [.], cksum 0x9341 (correct), ack 44103, win 1983, options [nop,nop,TS val 2265451202 ecr 2237938397], length 0
11:35:37.823523 IP (tos 0x0, ttl 64, id 0, offset 0, flags [DF], proto TCP (6), length 52)
    10.2.1.238.50163 > zoolab.cs.nctu.edu.tw.10001: Flags [.], cksum 0x9300 (correct), ack 44103, win 2048, options [nop,nop,TS val 2265451202 ecr 2237938397], length 0
11:35:37.823567 IP (tos 0x0, ttl 113, id 16356, offset 0, flags [DF], proto TCP (6), length 1434)
    zoolab.cs.nctu.edu.tw.10001 > 10.2.1.238.50163: Flags [.], cksum 0x7759 (correct), seq 44103:45485, ack 1, win 510, options [nop,nop,TS val 2237938397 ecr 2265451197], length 1382
11:35:37.823568 IP (tos 0x0, ttl 113, id 16357, offset 0, flags [DF], proto TCP (6), length 1434)
    zoolab.cs.nctu.edu.tw.10001 > 10.2.1.238.50163: Flags [.], cksum 0xe7f9 (correct), seq 45485:46867, ack 1, win 510, options [nop,nop,TS val 2237938397 ecr 2265451197], length 1382
11:35:37.823569 IP (tos 0x0, ttl 113, id 16358, offset 0, flags [DF], proto TCP (6), length 1434)
    zoolab.cs.nctu.edu.tw.10001 > 10.2.1.238.50163: Flags [P.], cksum 0xc9c5 (correct), seq 46867:48249, ack 1, win 510, options [nop,nop,TS val 2237938397 ecr 2265451197], length 1382
11:35:37.823589 IP (tos 0x0, ttl 64, id 0, offset 0, flags [DF], proto TCP (6), length 52)
    10.2.1.238.50163 > zoolab.cs.nctu.edu.tw.10001: Flags [.], cksum 0x830f (correct), ack 48249, win 1983, options [nop,nop,TS val 2265451202 ecr 2237938397], length 0
11:35:37.823695 IP (tos 0x0, ttl 64, id 0, offset 0, flags [DF], proto TCP (6), length 52)
    10.2.1.238.50163 > zoolab.cs.nctu.edu.tw.10001: Flags [.], cksum 0x82ce (correct), ack 48249, win 2048, options [nop,nop,TS val 2265451202 ecr 2237938397], length 0
11:35:37.824032 IP (tos 0x0, ttl 113, id 16359, offset 0, flags [DF], proto TCP (6), length 1434)
    zoolab.cs.nctu.edu.tw.10001 > 10.2.1.238.50163: Flags [.], cksum 0x6963 (correct), seq 48249:49631, ack 1, win 510, options [nop,nop,TS val 2237938397 ecr 2265451197], length 1382
11:35:37.824033 IP (tos 0x0, ttl 113, id 16360, offset 0, flags [DF], proto TCP (6), length 1434)
    zoolab.cs.nctu.edu.tw.10001 > 10.2.1.238.50163: Flags [.], cksum 0x96e5 (correct), seq 49631:51013, ack 1, win 510, options [nop,nop,TS val 2237938397 ecr 2265451197], length 1382
11:35:37.824034 IP (tos 0x0, ttl 113, id 16361, offset 0, flags [DF], proto TCP (6), length 1434)
    zoolab.cs.nctu.edu.tw.10001 > 10.2.1.238.50163: Flags [.], cksum 0x3bd4 (correct), seq 51013:52395, ack 1, win 510, options [nop,nop,TS val 2237938397 ecr 2265451197], length 1382
11:35:37.824062 IP (tos 0x0, ttl 64, id 0, offset 0, flags [DF], proto TCP (6), length 52)
    10.2.1.238.50163 > zoolab.cs.nctu.edu.tw.10001: Flags [.], cksum 0x72dd (correct), ack 52395, win 1983, options [nop,nop,TS val 2265451202 ecr 2237938397], length 0
11:35:37.824072 IP (tos 0x0, ttl 113, id 16362, offset 0, flags [DF], proto TCP (6), length 1434)
    zoolab.cs.nctu.edu.tw.10001 > 10.2.1.238.50163: Flags [.], cksum 0xc42b (correct), seq 52395:53777, ack 1, win 510, options [nop,nop,TS val 2237938397 ecr 2265451197], length 1382
11:35:37.824073 IP (tos 0x0, ttl 113, id 16363, offset 0, flags [DF], proto TCP (6), length 1434)
    zoolab.cs.nctu.edu.tw.10001 > 10.2.1.238.50163: Flags [.], cksum 0x7bac (correct), seq 53777:55159, ack 1, win 510, options [nop,nop,TS val 2237938397 ecr 2265451197], length 1382
11:35:37.824073 IP (tos 0x0, ttl 113, id 16364, offset 0, flags [DF], proto TCP (6), length 1434)
    zoolab.cs.nctu.edu.tw.10001 > 10.2.1.238.50163: Flags [P.], cksum 0xe53e (correct), seq 55159:56541, ack 1, win 510, options [nop,nop,TS val 2237938397 ecr 2265451197], length 1382
11:35:37.824088 IP (tos 0x0, ttl 64, id 0, offset 0, flags [DF], proto TCP (6), length 52)
    10.2.1.238.50163 > zoolab.cs.nctu.edu.tw.10001: Flags [.], cksum 0x62ec (correct), ack 56541, win 1918, options [nop,nop,TS val 2265451202 ecr 2237938397], length 0
11:35:37.824129 IP (tos 0x0, ttl 64, id 0, offset 0, flags [DF], proto TCP (6), length 52)
    10.2.1.238.50163 > zoolab.cs.nctu.edu.tw.10001: Flags [.], cksum 0x626a (correct), ack 56541, win 2048, options [nop,nop,TS val 2265451202 ecr 2237938397], length 0
11:35:37.824872 IP (tos 0x0, ttl 126, id 16365, offset 0, flags [DF], proto TCP (6), length 1434)
    zoolab.cs.nctu.edu.tw.10001 > 10.2.1.238.50163: Flags [.], cksum 0x679e (correct), seq 56541:57923, ack 1, win 510, options [nop,nop,TS val 2237938398 ecr 2265451197], length 1382
11:35:37.824872 IP (tos 0x0, ttl 126, id 16366, offset 0, flags [DF], proto TCP (6), length 1434)
    zoolab.cs.nctu.edu.tw.10001 > 10.2.1.238.50163: Flags [P.], cksum 0xcd97 (correct), seq 57923:59305, ack 1, win 510, options [nop,nop,TS val 2237938398 ecr 2265451197], length 1382
11:35:37.824873 IP (tos 0x0, ttl 113, id 16367, offset 0, flags [DF], proto TCP (6), length 1434)
    zoolab.cs.nctu.edu.tw.10001 > 10.2.1.238.50163: Flags [.], cksum 0xcd7f (correct), seq 59305:60687, ack 1, win 510, options [nop,nop,TS val 2237938399 ecr 2265451198], length 1382
11:35:37.824873 IP (tos 0x0, ttl 113, id 16368, offset 0, flags [DF], proto TCP (6), length 1434)
    zoolab.cs.nctu.edu.tw.10001 > 10.2.1.238.50163: Flags [P.], cksum 0x9bdf (correct), seq 60687:62069, ack 1, win 510, options [nop,nop,TS val 2237938399 ecr 2265451198], length 1382
11:35:37.824908 IP (tos 0x0, ttl 64, id 0, offset 0, flags [DF], proto TCP (6), length 52)
    10.2.1.238.50163 > zoolab.cs.nctu.edu.tw.10001: Flags [.], cksum 0x57c7 (correct), ack 59305, win 2004, options [nop,nop,TS val 2265451204 ecr 2237938398], length 0
11:35:37.824941 IP (tos 0x0, ttl 64, id 0, offset 0, flags [DF], proto TCP (6), length 52)
    10.2.1.238.50163 > zoolab.cs.nctu.edu.tw.10001: Flags [.], cksum 0x4d25 (correct), ack 62069, win 1961, options [nop,nop,TS val 2265451204 ecr 2237938399], length 0
11:35:37.824997 IP (tos 0x0, ttl 64, id 0, offset 0, flags [DF], proto TCP (6), length 52)
    10.2.1.238.50163 > zoolab.cs.nctu.edu.tw.10001: Flags [.], cksum 0x4cce (correct), ack 62069, win 2048, options [nop,nop,TS val 2265451204 ecr 2237938399], length 0
11:35:37.825676 IP (tos 0x0, ttl 113, id 16369, offset 0, flags [DF], proto TCP (6), length 1434)
    zoolab.cs.nctu.edu.tw.10001 > 10.2.1.238.50163: Flags [.], cksum 0x7a71 (correct), seq 62069:63451, ack 1, win 510, options [nop,nop,TS val 2237938399 ecr 2265451198], length 1382
11:35:37.825677 IP (tos 0x0, ttl 113, id 16370, offset 0, flags [DF], proto TCP (6), length 1434)
    zoolab.cs.nctu.edu.tw.10001 > 10.2.1.238.50163: Flags [.], cksum 0x34d7 (correct), seq 63451:64833, ack 1, win 510, options [nop,nop,TS val 2237938399 ecr 2265451198], length 1382
11:35:37.825678 IP (tos 0x0, ttl 113, id 16371, offset 0, flags [DF], proto TCP (6), length 1434)
    zoolab.cs.nctu.edu.tw.10001 > 10.2.1.238.50163: Flags [.], cksum 0x82f9 (correct), seq 64833:66215, ack 1, win 510, options [nop,nop,TS val 2237938399 ecr 2265451198], length 1382
11:35:37.825705 IP (tos 0x0, ttl 64, id 0, offset 0, flags [DF], proto TCP (6), length 52)
    10.2.1.238.50163 > zoolab.cs.nctu.edu.tw.10001: Flags [.], cksum 0x3cdd (correct), ack 66215, win 1983, options [nop,nop,TS val 2265451204 ecr 2237938399], length 0
11:35:37.825858 IP (tos 0x0, ttl 64, id 0, offset 0, flags [DF], proto TCP (6), length 52)
    10.2.1.238.50163 > zoolab.cs.nctu.edu.tw.10001: Flags [.], cksum 0x3c9b (correct), ack 66215, win 2048, options [nop,nop,TS val 2265451205 ecr 2237938399], length 0
11:35:37.825911 IP (tos 0x0, ttl 113, id 16372, offset 0, flags [DF], proto TCP (6), length 1434)
    zoolab.cs.nctu.edu.tw.10001 > 10.2.1.238.50163: Flags [.], cksum 0x8a4a (correct), seq 66215:67597, ack 1, win 510, options [nop,nop,TS val 2237938399 ecr 2265451198], length 1382
11:35:37.825911 IP (tos 0x0, ttl 113, id 16373, offset 0, flags [DF], proto TCP (6), length 1267)
    zoolab.cs.nctu.edu.tw.10001 > 10.2.1.238.50163: Flags [P.], cksum 0x8b82 (correct), seq 67597:68812, ack 1, win 510, options [nop,nop,TS val 2237938399 ecr 2265451198], length 1215
11:35:37.825931 IP (tos 0x0, ttl 64, id 0, offset 0, flags [DF], proto TCP (6), length 52)
    10.2.1.238.50163 > zoolab.cs.nctu.edu.tw.10001: Flags [.], cksum 0x329f (correct), ack 68812, win 2007, options [nop,nop,TS val 2265451205 ecr 2237938399], length 0
11:35:37.827271 IP (tos 0x0, ttl 123, id 16374, offset 0, flags [DF], proto TCP (6), length 986)
    zoolab.cs.nctu.edu.tw.10001 > 10.2.1.238.50163: Flags [P.], cksum 0xd3ae (correct), seq 68812:69746, ack 1, win 510, options [nop,nop,TS val 2237938401 ecr 2265451199], length 934
11:35:37.827272 IP (tos 0x0, ttl 126, id 16375, offset 0, flags [DF], proto TCP (6), length 1096)
    zoolab.cs.nctu.edu.tw.10001 > 10.2.1.238.50163: Flags [P.], cksum 0xc4a8 (correct), seq 69746:70790, ack 1, win 510, options [nop,nop,TS val 2237938401 ecr 2265451199], length 1044
11:35:37.827272 IP (tos 0x0, ttl 124, id 16376, offset 0, flags [DF], proto TCP (6), length 984)
    zoolab.cs.nctu.edu.tw.10001 > 10.2.1.238.50163: Flags [P.], cksum 0x713a (correct), seq 70790:71722, ack 1, win 510, options [nop,nop,TS val 2237938401 ecr 2265451199], length 932
11:35:37.827273 IP (tos 0x0, ttl 125, id 16377, offset 0, flags [DF], proto TCP (6), length 685)
    zoolab.cs.nctu.edu.tw.10001 > 10.2.1.238.50163: Flags [P.], cksum 0xf6a8 (correct), seq 71722:72355, ack 1, win 510, options [nop,nop,TS val 2237938401 ecr 2265451199], length 633
11:35:37.827273 IP (tos 0x0, ttl 127, id 16378, offset 0, flags [DF], proto TCP (6), length 897)
    zoolab.cs.nctu.edu.tw.10001 > 10.2.1.238.50163: Flags [P.], cksum 0xd670 (correct), seq 72355:73200, ack 1, win 510, options [nop,nop,TS val 2237938401 ecr 2265451199], length 845
11:35:37.827273 IP (tos 0x0, ttl 113, id 16379, offset 0, flags [DF], proto TCP (6), length 958)
    zoolab.cs.nctu.edu.tw.10001 > 10.2.1.238.50163: Flags [P.], cksum 0x6381 (correct), seq 73200:74106, ack 1, win 510, options [nop,nop,TS val 2237938402 ecr 2265451199], length 906
11:35:37.827305 IP (tos 0x0, ttl 64, id 0, offset 0, flags [DF], proto TCP (6), length 52)
    10.2.1.238.50163 > zoolab.cs.nctu.edu.tw.10001: Flags [.], cksum 0x2edc (correct), ack 69746, win 2033, options [nop,nop,TS val 2265451206 ecr 2237938401], length 0
11:35:37.827345 IP (tos 0x0, ttl 64, id 0, offset 0, flags [DF], proto TCP (6), length 52)
    10.2.1.238.50163 > zoolab.cs.nctu.edu.tw.10001: Flags [.], cksum 0x2743 (correct), ack 71722, win 2002, options [nop,nop,TS val 2265451206 ecr 2237938401], length 0
11:35:37.827359 IP (tos 0x0, ttl 64, id 0, offset 0, flags [DF], proto TCP (6), length 52)
    10.2.1.238.50163 > zoolab.cs.nctu.edu.tw.10001: Flags [.], cksum 0x2715 (correct), ack 71722, win 2048, options [nop,nop,TS val 2265451206 ecr 2237938401], length 0
11:35:37.827367 IP (tos 0x0, ttl 64, id 0, offset 0, flags [DF], proto TCP (6), length 52)
    10.2.1.238.50163 > zoolab.cs.nctu.edu.tw.10001: Flags [.], cksum 0x2167 (correct), ack 73200, win 2024, options [nop,nop,TS val 2265451206 ecr 2237938401], length 0
11:35:37.827481 IP (tos 0x0, ttl 114, id 16380, offset 0, flags [DF], proto TCP (6), length 411)
    zoolab.cs.nctu.edu.tw.10001 > 10.2.1.238.50163: Flags [P.], cksum 0x3085 (correct), seq 74106:74465, ack 1, win 510, options [nop,nop,TS val 2237938402 ecr 2265451199], length 359
11:35:37.827481 IP (tos 0x0, ttl 119, id 16381, offset 0, flags [DF], proto TCP (6), length 226)
    zoolab.cs.nctu.edu.tw.10001 > 10.2.1.238.50163: Flags [P.], cksum 0x6574 (correct), seq 74465:74639, ack 1, win 510, options [nop,nop,TS val 2237938402 ecr 2265451199], length 174
11:35:37.827483 IP (tos 0x0, ttl 64, id 0, offset 0, flags [DF], proto TCP (6), length 52)
    10.2.1.238.50163 > zoolab.cs.nctu.edu.tw.10001: Flags [.], cksum 0x1dc4 (correct), ack 74106, win 2048, options [nop,nop,TS val 2265451206 ecr 2237938402], length 0
11:35:37.827556 IP (tos 0x0, ttl 64, id 0, offset 0, flags [DF], proto TCP (6), length 52)
    10.2.1.238.50163 > zoolab.cs.nctu.edu.tw.10001: Flags [.], cksum 0x1baf (correct), ack 74639, win 2048, options [nop,nop,TS val 2265451206 ecr 2237938402], length 0
11:35:37.827985 IP (tos 0x0, ttl 114, id 16382, offset 0, flags [DF], proto TCP (6), length 243)
    zoolab.cs.nctu.edu.tw.10001 > 10.2.1.238.50163: Flags [P.], cksum 0x9101 (correct), seq 74639:74830, ack 1, win 510, options [nop,nop,TS val 2237938402 ecr 2265451199], length 191
11:35:37.827986 IP (tos 0x0, ttl 116, id 16383, offset 0, flags [DF], proto TCP (6), length 299)
    zoolab.cs.nctu.edu.tw.10001 > 10.2.1.238.50163: Flags [P.], cksum 0xd68b (correct), seq 74830:75077, ack 1, win 510, options [nop,nop,TS val 2237938402 ecr 2265451199], length 247
11:35:37.827986 IP (tos 0x0, ttl 113, id 16384, offset 0, flags [DF], proto TCP (6), length 123)
    zoolab.cs.nctu.edu.tw.10001 > 10.2.1.238.50163: Flags [P.], cksum 0x1fba (correct), seq 75077:75148, ack 1, win 510, options [nop,nop,TS val 2237938403 ecr 2265451199], length 71
11:35:37.827986 IP (tos 0x0, ttl 121, id 16385, offset 0, flags [DF], proto TCP (6), length 613)
    zoolab.cs.nctu.edu.tw.10001 > 10.2.1.238.50163: Flags [P.], cksum 0x8764 (correct), seq 75148:75709, ack 1, win 510, options [nop,nop,TS val 2237938403 ecr 2265451202], length 561
11:35:37.828060 IP (tos 0x0, ttl 64, id 0, offset 0, flags [DF], proto TCP (6), length 52)
    10.2.1.238.50163 > zoolab.cs.nctu.edu.tw.10001: Flags [.], cksum 0x1780 (correct), ack 75709, win 2048, options [nop,nop,TS val 2265451207 ecr 2237938402], length 0
11:35:37.828102 IP (tos 0x0, ttl 128, id 16386, offset 0, flags [DF], proto TCP (6), length 179)
    zoolab.cs.nctu.edu.tw.10001 > 10.2.1.238.50163: Flags [P.], cksum 0xc8d1 (correct), seq 75709:75836, ack 1, win 510, options [nop,nop,TS val 2237938403 ecr 2265451202], length 127
11:35:37.828103 IP (tos 0x0, ttl 126, id 16387, offset 0, flags [DF], proto TCP (6), length 1134)
    zoolab.cs.nctu.edu.tw.10001 > 10.2.1.238.50163: Flags [P.], cksum 0x64bb (correct), seq 75836:76918, ack 1, win 510, options [nop,nop,TS val 2237938403 ecr 2265451202], length 1082
11:35:37.828132 IP (tos 0x0, ttl 64, id 0, offset 0, flags [DF], proto TCP (6), length 52)
    10.2.1.238.50163 > zoolab.cs.nctu.edu.tw.10001: Flags [.], cksum 0x12c6 (correct), ack 76918, win 2048, options [nop,nop,TS val 2265451207 ecr 2237938403], length 0
11:35:37.829484 IP (tos 0x0, ttl 116, id 16388, offset 0, flags [DF], proto TCP (6), length 491)
    zoolab.cs.nctu.edu.tw.10001 > 10.2.1.238.50163: Flags [P.], cksum 0xd8a7 (correct), seq 76918:77357, ack 1, win 510, options [nop,nop,TS val 2237938403 ecr 2265451202], length 439
11:35:37.829484 IP (tos 0x0, ttl 127, id 16389, offset 0, flags [DF], proto TCP (6), length 1113)
    zoolab.cs.nctu.edu.tw.10001 > 10.2.1.238.50163: Flags [P.], cksum 0x5162 (correct), seq 77357:78418, ack 1, win 510, options [nop,nop,TS val 2237938403 ecr 2265451202], length 1061
11:35:37.829485 IP (tos 0x0, ttl 125, id 16390, offset 0, flags [DF], proto TCP (6), length 762)
    zoolab.cs.nctu.edu.tw.10001 > 10.2.1.238.50163: Flags [P.], cksum 0x50d5 (correct), seq 78418:79128, ack 1, win 510, options [nop,nop,TS val 2237938404 ecr 2265451202], length 710
11:35:37.829512 IP (tos 0x0, ttl 64, id 0, offset 0, flags [DF], proto TCP (6), length 52)
    10.2.1.238.50163 > zoolab.cs.nctu.edu.tw.10001: Flags [.], cksum 0x0d01 (correct), ack 78418, win 2024, options [nop,nop,TS val 2265451208 ecr 2237938403], length 0
11:35:37.829559 IP (tos 0x0, ttl 64, id 0, offset 0, flags [DF], proto TCP (6), length 52)
    10.2.1.238.50163 > zoolab.cs.nctu.edu.tw.10001: Flags [.], cksum 0x0a2e (correct), ack 79128, win 2036, options [nop,nop,TS val 2265451208 ecr 2237938404], length 0
11:35:37.829822 IP (tos 0x0, ttl 113, id 16391, offset 0, flags [DF], proto TCP (6), length 923)
    zoolab.cs.nctu.edu.tw.10001 > 10.2.1.238.50163: Flags [P.], cksum 0xc31d (correct), seq 79128:79999, ack 1, win 510, options [nop,nop,TS val 2237938404 ecr 2265451202], length 871
11:35:37.829823 IP (tos 0x0, ttl 125, id 16392, offset 0, flags [DF], proto TCP (6), length 609)
    zoolab.cs.nctu.edu.tw.10001 > 10.2.1.238.50163: Flags [P.], cksum 0x4b8a (correct), seq 79999:80556, ack 1, win 510, options [nop,nop,TS val 2237938404 ecr 2265451202], length 557
11:35:37.829823 IP (tos 0x0, ttl 114, id 16393, offset 0, flags [DF], proto TCP (6), length 338)
    zoolab.cs.nctu.edu.tw.10001 > 10.2.1.238.50163: Flags [P.], cksum 0x7c10 (correct), seq 80556:80842, ack 1, win 510, options [nop,nop,TS val 2237938404 ecr 2265451202], length 286
11:35:37.829824 IP (tos 0x0, ttl 126, id 16394, offset 0, flags [DF], proto TCP (6), length 373)
    zoolab.cs.nctu.edu.tw.10001 > 10.2.1.238.50163: Flags [P.], cksum 0x7a64 (correct), seq 80842:81163, ack 1, win 510, options [nop,nop,TS val 2237938404 ecr 2265451202], length 321
11:35:37.829840 IP (tos 0x0, ttl 64, id 0, offset 0, flags [DF], proto TCP (6), length 52)
    10.2.1.238.50163 > zoolab.cs.nctu.edu.tw.10001: Flags [.], cksum 0x04a5 (correct), ack 80556, win 2025, options [nop,nop,TS val 2265451208 ecr 2237938404], length 0
11:35:37.829853 IP (tos 0x0, ttl 64, id 0, offset 0, flags [DF], proto TCP (6), length 52)
    10.2.1.238.50163 > zoolab.cs.nctu.edu.tw.10001: Flags [.], cksum 0x0375 (correct), ack 80842, win 2043, options [nop,nop,TS val 2265451208 ecr 2237938404], length 0
11:35:37.829893 IP (tos 0x0, ttl 64, id 0, offset 0, flags [DF], proto TCP (6), length 52)
    10.2.1.238.50163 > zoolab.cs.nctu.edu.tw.10001: Flags [.], cksum 0x022f (correct), ack 81163, win 2048, options [nop,nop,TS val 2265451208 ecr 2237938404], length 0
